id,report_id,ticker,company,date,source,doc_type,item,section_type,section_heading,chunk_index,page_start,page_end,text,source_file
3adb53676bf7a5d4cd8b3f8c8d274044-0,3adb53676bf7a5d4cd8b3f8c8d274044,NKE,nike,2025-12-10T16:34:47Z,newsapi,news,,news,"From New Balance to ROA, the Seven Best Sneakers to Cop Right Now",0,,,"This weekly guide sorts the very best from the rest when it comes to the saturated world of sneaker releases, with information on release dates and where to buy. Please note: Some sneakers may sell o… [+3099 chars]",https://www.highsnobiety.com/p/sneaker-releases-2025-december-week-2/
e23efdf4194065b52597bca9df319de1-0,e23efdf4194065b52597bca9df319de1,NKE,nike,2025-12-13T23:33:00Z,newsapi,news,,news,Kobe's Nike Air Force 1 Is Quite Literally a Portrait of the GOAT,0,,,"Another Kobe Bryant Air Force 1 has arrived, and this one leans fully into feel. The Kobe Bryant x Nike Air Force 1 Low QS Linen/University Blue sneaker updates the familiar silhouette with soft mate… [+1595 chars]",https://www.highsnobiety.com/p/kobe-bryant-nike-air-force-1-low-protro-linen-university-blue/
84a57b0a782f647929b253c5773be0ee-0,84a57b0a782f647929b253c5773be0ee,NKE,nike,2025-12-16T16:26:02Z,newsapi,news,,news,"From Birkenstock to Nike, the Seven Best Sneakers to Cop Right Now",0,,,"This weekly guide sorts the very best from the rest when it comes to the saturated world of sneaker releases, with information on release dates and where to buy. Please note: Some sneakers may sell o… [+3814 chars]",https://www.highsnobiety.com/p/sneaker-releases-2025-december-week-3/
2d1f6bd26c93b484a2e7afcc1b0228ed-0,2d1f6bd26c93b484a2e7afcc1b0228ed,NKE,nike,2025-12-20T21:54:18Z,newsapi,news,,news,NIGO Put Luxe Varsity Jackets on His Rugged Nike Forces,0,,,"Just when you thought NIGO had done it all with Nike's Air Force 3, the designer gives the classic sneaker its own luxe varsity jacket.
NIGO's next batch of Air Force 3 sneakers again boasts quality… [+1138 chars]",https://www.highsnobiety.com/p/nigo-nike-air-force-3-2026/
5e44563115f38e6e65d91593fb8343ea-0,5e44563115f38e6e65d91593fb8343ea,NKE,nike,2025-12-22T21:16:28Z,newsapi,news,,news,"In “Army Olive,” Nike’s Tonal Air Force 1 Becomes a High-Ranking Stepper",0,,,"Nothing quite beats tonal Air Force 1s. Some of the greatest pairs come in a single color (cough, the classic ""Triple White"" and ""Triple Black"", cough).
Somewhere along the list, you might even find… [+1093 chars]",https://www.highsnobiety.com/p/nike-air-force-1-army-olive/
f09092b8f22ef2c40d01e3eea050319f-0,f09092b8f22ef2c40d01e3eea050319f,NKE,nike,2025-12-09T19:43:54Z,newsapi,news,,news,Nike’s Hardy Air Max Boot Is Too Clean for Its Own Good,0,,,"Winter may be ahead of schedule this year. But don't worry, Nike's Air Max Goadome boot is here for the rescue.
The trusty sneaker-boot offers rugged leather uppers and super-rugged traction, making… [+1067 chars]",https://www.highsnobiety.com/p/nike-air-max-goadome-summit-white/
bd90126e25673bc9350a633972fe3f05-0,bd90126e25673bc9350a633972fe3f05,NKE,nike,2025-12-02T11:00:00Z,newsapi,news,,news,"From adidas to ASICS, the Seven Best Sneakers to Cop Right Now",0,,,"This weekly guide sorts the very best from the rest when it comes to the saturated world of sneaker releases, with information on release dates and where to buy. Please note: Some sneakers may sell o… [+3173 chars]",https://www.highsnobiety.com/p/sneaker-releases-2025-december-week-1/
cf66d1adec23325cee569b5c653a836c-0,cf66d1adec23325cee569b5c653a836c,NKE,nike,2025-12-12T23:55:01Z,newsapi,news,,news,The Ronaldinho Nike Sneaker Has the Golden Touch,0,,,"Ronaldinho Gaúcho was about touch, the almost mythical ability to put the ball exactly where it needed to be, again and again, until repetition felt magical. 
That instinct now shows up off the pitc… [+1626 chars]",https://www.highsnobiety.com/p/ronaldinho-nike-tiempo-legend-touch-of-gold/
91e24ad65cb32fe47c39537dfb171f69-0,91e24ad65cb32fe47c39537dfb171f69,NKE,nike,2025-12-04T17:04:23Z,newsapi,news,,news,Apple Issues New Warning Affecting Millions of Customers,0,,,"If you've been holding on to an older iPhone, iPad, Mac laptop, or even an Apple Watch and Apple TV device to avoid shelling out big bucks for the latest version, your time might have just run out.
… [+6229 chars]",https://www.mensjournal.com/news/apple-issues-major-warning-affecting-millions-of-customers
d87b17ab3e5517315199d89289f4bdbe-0,d87b17ab3e5517315199d89289f4bdbe,NKE,nike,2025-12-11T10:05:01Z,newsapi,news,,news,"I made $560,000 in revenue last year reselling products on Amazon. Here's exactly how I do it.",0,,,"Damilola Olaleye.Courtesy of Damilola Olaleye
<ul><li>Damilola Olaleye began building an Amazon reselling business during her maternity leave in 2023.</li><li>She scaled up using data-driven strateg… [+7636 chars]",https://www.businessinsider.com/made-560000-revenue-selling-items-amazon-after-tech-layoff-2025-12
bbdb77f64e9231cf2a55e6aa989f1164-0,bbdb77f64e9231cf2a55e6aa989f1164,NKE,nike,2025-12-22T19:40:49Z,newsapi,news,,news,Nike's Frankenstein Shox Sneaker Has Never Looked Cleaner,0,,,"Nike's Total 90 Shox Magia is looking quite clean for its comeback.
The model technically returned in 2025 through a red-hot collaboration with Maha Amsterdam. The women's sneaker boutique delivered… [+1440 chars]",https://www.highsnobiety.com/p/nike-total-90-shox-magia-sail/
315d078c90d6c716044b67712244ed78-0,315d078c90d6c716044b67712244ed78,NKE,nike,2025-12-22T17:20:48Z,newsapi,news,,news,Nike Wants You To Look & Feel Good 24/7,0,,,"Nike activewear needs no introduction. Worn by both athletes and purveyors of comfortable clothing alike, its versatile garments are suited to nearly every occasion.
Nike has clearly found its sweet… [+1493 chars]",https://www.highsnobiety.com/p/nike-24-7-collection-shop-now/
c088e62aaff28f3347b449a7781aca40-0,c088e62aaff28f3347b449a7781aca40,NKE,nike,2025-12-14T12:44:00Z,newsapi,news,,news,The Triple-Stacked Jordan 1 Platform Sneaker Is Freakishly Thicc,0,,,"Have you ever seen a Jordan 1 stacked like this? The new Nike Air Jordan 1 Triple Stack Sail/Black sneaker takes the familiar low-top silhouette and quite literally pushes it higher.
The Triple Stac… [+1799 chars]",https://www.highsnobiety.com/p/nike-air-jordan-1-triple-stack-sail/
fca45a1010c5d7b93d7c6143e7b0e627-0,fca45a1010c5d7b93d7c6143e7b0e627,NKE,nike,2025-12-21T15:44:50Z,newsapi,news,,news,Jim Cramer Highlights Nike Struggles,0,,,"NIKE, Inc. (NYSE:NKE) is one of the tech and consumer sector stocks that Jim Cramer talked about. Cramer mentioned the stock while discussing consumer trends, as he said:
If the Fed cuts rates, the … [+1760 chars]",https://finance.yahoo.com/news/jim-cramer-highlights-nike-struggles-154450451.html
ea2392eea525cbad923a3b8d15bff3dd-0,ea2392eea525cbad923a3b8d15bff3dd,NKE,nike,2025-12-12T12:43:00Z,newsapi,news,,news,"New Balance’s Killer Skate Shoe Takes Nike ""Panda""",0,,,"New Balances Numeric 480 has quietly become the brands most reliable skate silhouette, often described as the dad-shoe brands answer to the Nike Dunk. With its next release, the shoe leans fully into… [+1801 chars]",https://www.highsnobiety.com/p/new-balance-numeric-480-panda/
0d2411c66c191672119d507a7e781cdb-0,0d2411c66c191672119d507a7e781cdb,NKE,nike,2025-12-02T13:52:42Z,newsapi,news,,news,"From Nike to Saucony, Browse This Week’s Best Sneaker Releases",0,,,"This weekly guide sorts the very best from the rest when it comes to the saturated world of sneaker releases, with information on prices and where to buy. Please note some sneakers may sell out at sp… [+2789 chars]",https://www.highsnobiety.com/p/sneaker-releases-march-week-2-2025/
fcb014fecb3ba12f5f734a29e91bf80d-0,fcb014fecb3ba12f5f734a29e91bf80d,NKE,nike,2025-12-06T21:44:00Z,newsapi,news,,news,Nike Just Sewed the AF1 a Luxe Suit Jacket,0,,,"Nikes smartest Air Force 1 shoes look like they were pieced together in a workshop, and the forty-year-old silhouette is better for it. The Nike Air Force 1 Low Dark Hazel stitches a quiet, tailored-… [+1523 chars]",https://www.highsnobiety.com/p/nike-air-force-1-low-sequoia-dark-hazel/
6f3c7b5ff3f582e29ff594dccd5d6b78-0,6f3c7b5ff3f582e29ff594dccd5d6b78,NKE,nike,2025-12-23T19:42:31Z,newsapi,news,,news,Nike's Minimalist Running Shoe Becomes a Lowkey Fly Slip-on,0,,,"Remember the Nike Air Superfly? It's a slip-on sneaker now.
Nike calls this new laceless version the Air Superfly Moc. And it maintains most of the original slender design, except now in easy-on for… [+1038 chars]",https://www.highsnobiety.com/p/nike-air-superfly-moc/
48a380265ef2e3dfdb8f5d0fe92919ea-0,48a380265ef2e3dfdb8f5d0fe92919ea,NKE,nike,2025-12-19T18:18:49Z,newsapi,news,,news,This Ain’t a Normal Black Nike Air Force 1. It’s an Effortlessly Clean “NYKE” Shoe,0,,,"Black Nike Air Force 1, is that you? Not quite. It's more like an impressive ""Nyke"" sneaker.
Nike's latest night-mode Air Force 1 isn't your regular Air Force 1. It arrives with high-quality leather… [+1636 chars]",https://www.highsnobiety.com/p/nike-air-force-1-nyke-black/
58a1de883c485dc1db222a3d3f8b427c-0,58a1de883c485dc1db222a3d3f8b427c,NKE,nike,2025-12-19T04:55:02Z,newsapi,news,,news,The Most Classic Nike Sneaker Became a Work of Wearable Chinese Art,0,,,"2026 marks the Year of the Horse. For anyone who follows the Chinese Zodiac, the horse is often associated with momentum, confidence, and forward motion. Nike is tapping into that symbolism with a Fi… [+1846 chars]",https://www.highsnobiety.com/p/nike-field-general-year-of-the-horse/
9fed43845944501fe4019f91e85ac5fb-0,9fed43845944501fe4019f91e85ac5fb,NKE,nike,2025-12-11T23:44:00Z,newsapi,news,,news,The Angular Nike First Sight Sneaker Is a Sculptural Cyberpunk Marvel,0,,,"Do you believe in love at first sight? Nike does. Nike's First Sight sneaker is a techy sneak peek into the future of Nikes footwear offerings for women. Turns out, the Swoosh is betting big on beaut… [+1818 chars]",https://www.highsnobiety.com/p/nike-first-sight-sneaker/
3fc0767dbcad3b58387beebd77fe5f5c-0,3fc0767dbcad3b58387beebd77fe5f5c,NKE,nike,2025-12-09T19:47:03Z,newsapi,news,,news,Nike C1TY Men's Shoes (College Grey/Black/Fire Red) $42.50 + Free Shipping,0,,,"This collaborative space allows users to contribute additional information, tips, and insights to enhance the original deal post. Feel free to share your knowledge and help fellow shoppers make infor… [+26 chars]",https://slickdeals.net/f/18946117-nike-men-s-c1ty-shoes-college-grey-black-red-42-50-free-shipping
a0062f74cdb0a2eec9720b07d3814679-0,a0062f74cdb0a2eec9720b07d3814679,NKE,nike,2025-12-13T19:28:01Z,newsapi,news,,news,Nike Men's Air Force 1 '07 LV8 NA3 Shoes (Light Blue/Multicolor/Photon Dust) $56 + Free Shipping,0,,,"This collaborative space allows users to contribute additional information, tips, and insights to enhance the original deal post. Feel free to share your knowledge and help fellow shoppers make infor… [+26 chars]",https://slickdeals.net/f/18964081-nike-men-s-air-force-1-07-lv8-na3-shoes-light-blue-multicolor-photon-dust-56-free-shipping
ccad220df6e912ae77d5daa39b74d2b4-0,ccad220df6e912ae77d5daa39b74d2b4,NKE,nike,2025-12-16T23:41:22Z,newsapi,news,,news,Nike Men's Air Jordan 1 Mid SE Shoes (Summit White/Blue Chill/Anthracite) $56 + Free Shipping,0,,,"This collaborative space allows users to contribute additional information, tips, and insights to enhance the original deal post. Feel free to share your knowledge and help fellow shoppers make infor… [+26 chars]",https://slickdeals.net/f/18980260-nike-men-s-air-jordan-1-mid-se-shoes-summit-white-blue-chill-anthracite-56-free-shipping
0c0275c0c42f9f8608910f707a2cfd88-0,0c0275c0c42f9f8608910f707a2cfd88,NKE,nike,2025-12-17T23:40:02Z,newsapi,news,,news,Nike Women's Air Jordan 1 Low Shoes (Sail/Pink) $40 + Free Shipping,0,,,"This collaborative space allows users to contribute additional information, tips, and insights to enhance the original deal post. Feel free to share your knowledge and help fellow shoppers make infor… [+26 chars]",https://slickdeals.net/f/18985540-nike-women-s-air-jordan-1-low-shoes-sail-pink-40-free-shipping
47f734062cdfa2b4470410c0e0684cc4-0,47f734062cdfa2b4470410c0e0684cc4,NKE,nike,2025-12-25T22:22:00Z,newsapi,news,,news,Nike Men's Court Vision Low Next Nature Shoes (White or Black) from $40 + Free Shipping,0,,,"This collaborative space allows users to contribute additional information, tips, and insights to enhance the original deal post. Feel free to share your knowledge and help fellow shoppers make infor… [+70 chars]",https://slickdeals.net/f/19016842-nike-men-s-court-vision-low-next-nature-shoes-white-or-black-from-40-free-shipping
193942a69c6568152ae09c74b38846d5-0,193942a69c6568152ae09c74b38846d5,NKE,nike,2025-12-16T20:10:14Z,newsapi,news,,news,Nike's Exquisite Leather Shox Is Low-key Built Like a Dress Shoe,0,,,"Years later, Nike's Shox sneakers remain one of the craziest models to put their tech on full display for the world. Nike has maintained its classic aughts look for the most part, but it has also int… [+1517 chars]",https://www.highsnobiety.com/p/nike-shox-ride-2-premium-off-white-leather/
30060575091e03f346b5f2e4fa11e304-0,30060575091e03f346b5f2e4fa11e304,NKE,nike,2025-12-09T15:46:49Z,newsapi,news,,news,Nike Men's Air Zoom Pegasus 41 Shoes (Ghost/Blue) $51 + Free Shipping,0,,,"This collaborative space allows users to contribute additional information, tips, and insights to enhance the original deal post. Feel free to share your knowledge and help fellow shoppers make infor… [+26 chars]",https://slickdeals.net/f/18945925-nike-men-s-air-zoom-pegasus-41-shoes-ghost-blue-51-free-shipping
d88f004c622f59ce31d9e8647da70a8a-0,d88f004c622f59ce31d9e8647da70a8a,NKE,nike,2025-12-14T19:02:14Z,newsapi,news,,news,Nike Men's Air Jordan Retro 1 Mid Casual Shoes (Black/Varsity Red/Summit White) $68 + Free Shipping on $75+,0,,,"This collaborative space allows users to contribute additional information, tips, and insights to enhance the original deal post. Feel free to share your knowledge and help fellow shoppers make infor… [+26 chars]",https://slickdeals.net/f/18967321-nike-men-s-air-jordan-retro-1-mid-casual-shoes-black-varsity-red-summit-white-68-free-shipping-on-75
c3e1d50ce5f09f34fed6f1fd0ca96f7c-0,c3e1d50ce5f09f34fed6f1fd0ca96f7c,NKE,nike,2025-12-19T17:18:14Z,newsapi,news,,news,Nike’s Fine Leather Sneaker Returns to Its Roots,0,,,"Nike's next leather Field General looks to relive the model's glory days.
Before becoming a clean everyday shoe co-signed by Timothée Chalament, the Nike Field General started as a football sneaker,… [+1329 chars]",https://www.highsnobiety.com/p/nike-field-general-brown-leather/
35cd06dc877467c440244767c8cc4246-0,35cd06dc877467c440244767c8cc4246,NKE,nike,2025-12-19T22:19:12Z,newsapi,news,,news,Nike’s Slick Air Max Skate Shoe Makes the Blues Actually Look Great,0,,,"Another day, another good-looking Nike SB Air Max Ishod sneaker.
Ishod Wair's signature Nike skate shoe has emerged in a satisfying ""Blue Void"" colorway, making ""the blues"" look quite good.
The sle… [+1198 chars]",https://www.highsnobiety.com/p/nike-air-max-ishod-blue-void/
3e3ca85c0699d25a1390ec02f00c5378-0,3e3ca85c0699d25a1390ec02f00c5378,NKE,nike,2025-12-21T17:16:39Z,newsapi,news,,news,Nike's Thickest Running Shoe Is Also Its Tastiest,0,,,"Nike's Vomero Premium sneaker is easily one of the brand's biggest running shoes (literally). And in its latest ""Chalk"" colorway, it just might be its tastiest, too. 
Admittedly, chalk doesn't sound… [+1158 chars]",https://www.highsnobiety.com/p/nike-vomero-premium-chalk/
a2c879c1a579cbccbb66913477a729a3-0,a2c879c1a579cbccbb66913477a729a3,NKE,nike,2025-12-24T16:22:00Z,newsapi,news,,news,Nike’s Absurdly Hi-Tech Ava Rover Sneaker Is a Ninja Shoe for the Streets,0,,,"If it ain't broke, don't fix it. Just do it again and again. This is Nike's approach to maintaining the hype surrounding its Ava Rover shoe. 
Looking like it came straight from Mars, the ""Earth/Brig… [+1827 chars]",https://www.highsnobiety.com/p/nike-ava-rover-sneaker-brown/
cd50d8396a3797f9aea8790c09ae8dc2-0,cd50d8396a3797f9aea8790c09ae8dc2,NKE,nike,2025-12-16T15:34:30Z,newsapi,news,,news,Touch Grass? Nike's Plush Slides Literally Are Grass,0,,,"Sometimes you really need to go out and touch grass. But Nike just made it possible to do that without leaving your apartment.
The latest Nike ReactX Rejuven8 Slide takes one of the internets most o… [+1887 chars]",https://www.highsnobiety.com/p/swoosh-nike-reactx-rejuven8-slide-touch-grass/
60e183a5313612a37037111b0017225b-0,60e183a5313612a37037111b0017225b,NKE,nike,2025-12-27T08:01:46Z,newsapi,news,,news,Hit the Gym In These New Fitness Fits for Fellas In 2026,0,,,"TMZ may collect a share of sales or other compensation from links on this page.
Alright, fellas ... this one is for you! If your New Year's Resolution is to hit the gym more in 2026, then you better… [+4045 chars]",https://www.tmz.com/2025/12/27/fitness-outfits-for-him/
f0181375f18009967608d55a8a3c6103-0,f0181375f18009967608d55a8a3c6103,NKE,nike,2025-12-07T13:06:02Z,newsapi,news,,news,3 of the best and 4 of the worst gameday outfits Travis Kelce has worn this year,0,,,"Travis Kelce at Arrowhead Stadium on October 27.David Eulitt/Getty Images
<ul><li>Travis Kelce's gameday outfits have gotten as much attention as his athletic performances this year.</li><li>His bes… [+3884 chars]",https://www.businessinsider.com/travis-kelce-best-and-worst-gameday-outfits-2025-12
b98085aac1a443e268de30cc06976edb-0,b98085aac1a443e268de30cc06976edb,NKE,nike,2025-12-15T20:46:00Z,newsapi,news,,news,Nike’s Chocalate Brown Air Force 1 Is Deliciously Understated,0,,,"Delicious isnt a word you usually associate with sneakers, but it fits the Nike Air Force 1 Low Velvet Brown surprisingly well. Its one of Nikes most indulgent takes on the Uptown, a familiar silhoue… [+1671 chars]",https://www.highsnobiety.com/p/nike-air-force-1-velvet-brown-leather/
0bf2dddf8cc1b631645641aa14726140-0,0bf2dddf8cc1b631645641aa14726140,NKE,nike,2025-12-17T01:12:01Z,newsapi,news,,news,Nike’s Clean White Air Force 1 Has Sunshine in Its Sole,0,,,"An Air Force 1 with a sunny disposition? Why not? Nikes 40-year-old basketball staple gets a fresh coat of design seemingly every week. From dark, chocolatey leather pairs to quietly luxe, stitched-u… [+1648 chars]",https://www.highsnobiety.com/p/nike-air-force-1-sunshine-gradient-sole/
f29dc43ed3a91eb240c0cb5feb3d133a-0,f29dc43ed3a91eb240c0cb5feb3d133a,NKE,nike,2025-12-08T23:44:00Z,newsapi,news,,news,"Even With Laces, adidas’ Taekwondo Slipper Is Good as Gold",0,,,"Ronaldinho Gaúcho was about touch, the almost mythical ability to put the ball exactly where it needed to be, again and again, until repetition felt magical. 
That instinct now shows up off the pitc… [+1619 chars]",https://www.highsnobiety.com/p/adidas-taekwondo-lace-gold-core-black-off-white/
75799ef2404b1cef3b5670371c79f50e-0,75799ef2404b1cef3b5670371c79f50e,NKE,nike,2025-12-25T19:33:00Z,newsapi,news,,news,The Lemony Fresh Jordan 1’s GORE-TEX Era Peaks on The Trail,0,,,"Yes, the Nike Air Jordan 1 is now a GORE-TEX-wearing trail runner. Well, sort of. The Nike Air Jordan 1 Low Element GORE-TEX Phantom/Light Lemon Twist continues the gradual shift of Michael Jordans m… [+1503 chars]",https://www.highsnobiety.com/p/nike-air-jordan-1-low-element-gore-tex-phantom-lemon-twist/
04b9a5d643078002f71725524a57b0e5-0,04b9a5d643078002f71725524a57b0e5,NKE,nike,2025-12-01T10:36:12Z,newsapi,news,,news,I never expected to sell pencils. The brand I've built has grown into a $1.7 million sustainability business.,0,,,"Michael Stausholm bought a pencil that could be planted by MIT students.Courtesy of Michael Stausholm
<ul><li>Michael Stausholm bought the rights to a sustainable pencil from grad students at MIT.</… [+4661 chars]",https://www.businessinsider.com/turned-student-invention-into-global-eco-friendly-brand-sproutworld-2025-12
95fa50a690583cf26ac03ca6e6cee8aa-0,95fa50a690583cf26ac03ca6e6cee8aa,NKE,nike,2025-12-15T23:44:01Z,newsapi,news,,news,Nike’s Ultra-Fly Pegasus Premium Shoe Is Sweeter Without a Swoosh,0,,,"Nike's Pegasus sneaker is looking unrecognizable in the best way possible. The Nike Pegasus Premium is one of the coolest offerings to come from Nike's running shoe arsenal, and now this ""cool kid"" s… [+1778 chars]",https://www.highsnobiety.com/p/nike-pegasus-premium-brown/
8fb4a5895e7a57e97832ae3145781e7c-0,8fb4a5895e7a57e97832ae3145781e7c,NKE,nike,2025-12-16T18:16:49Z,newsapi,news,,news,Nike’s Ultra-Stylish Running Shoe Looks Good Even When It's Not Trying,0,,,"Nike's Vomero Plus sneaker makes even its most basic outfits worthy of attention.
It's hard to ignore the sneaker as is. It comes with these gigantic soles injected with plentiful amounts of Nike's … [+1450 chars]",https://www.highsnobiety.com/p/nike-vomero-plus-white/
827d83d84ca5cfc0b757f4a9b0cf989d-0,827d83d84ca5cfc0b757f4a9b0cf989d,NKE,nike,2025-12-18T18:17:54Z,newsapi,news,,news,Nike’s Massaging Dad Shoe Speaks to Your Mind — Through Your Feet,0,,,"There's a real science to Nike's footwear offerings in a literal sense. Nike's Mind 002 sneaker is a functional fusion of an orthopedic dad shoe and an official neuroscience experiment, an unlikely p… [+1657 chars]",https://www.highsnobiety.com/p/nike-mind-002-sneaker-white/
948ca2c5b0f7072a0e68a77f59132755-0,948ca2c5b0f7072a0e68a77f59132755,NKE,nike,2025-12-01T01:11:34Z,newsapi,news,,news,"Nike Air Max Men's DN8 Shoes (Black/Volt, Select Sizes) $64 + Free Shipping",0,,,"This collaborative space allows users to contribute additional information, tips, and insights to enhance the original deal post. Feel free to share your knowledge and help fellow shoppers make infor… [+26 chars]",https://slickdeals.net/f/18903841-air-max-dn-or-air-max-dn8-64-get-20-off-with-code-cyber20-updated-style-available
cf407fe9537cc7cff3f0d56c76de86c0-0,cf407fe9537cc7cff3f0d56c76de86c0,NKE,nike,2025-12-15T00:01:51Z,newsapi,news,,news,Select Caps: Nike Pro Golf Training Strapback Hat $2 each & More + Free Shipping,0,,,JD Sports has Select Caps on sale for $12 - $10 when you apply the one-time Status Reward = $2 when you follow the steps below. Shipping is free.Thanks to Deal Hunter daisybeetle for sharing this dea… [+874 chars],https://slickdeals.net/f/18969262-select-caps-new-era-9fifty-a-frame-trucker-nike-pro-golf-training-strapback-hat-2-each-more-free-shipping
5f922d2adea94483311ca54f04ba73b9-0,5f922d2adea94483311ca54f04ba73b9,ATZ,atz,2025-12-20T10:55:01Z,newsapi,news,,news,I went to see the hype about Aritzia's Super Puff for myself. I left with a $300 coat.,0,,,"The modern taupe liquid shine Super Puff was available in an extra-large.Jordan Hart/Business Insider
<ul><li>Aritzia's Super Puff puffer coat lives up to its viral hype and popularity.</li><li>High… [+4270 chars]",https://www.businessinsider.com/aritzia-super-puff-coat-price-styles-availability-2025-12
85d06731fb1c9c177393344a45b7e707-0,85d06731fb1c9c177393344a45b7e707,ATZ,atz,2025-12-05T17:49:06Z,newsapi,news,,news,Tech Tactics: Aritzia Taps Nedap’s RFID Platform to Strengthen Store Operations,0,,,"Tech Tactics is Sourcing Journals series with brands and technology companies to discuss their latest innovations.
Aritzia is taking a more precise approach to managing its inventory.
More from Sou… [+3021 chars]",https://sourcingjournal.com/topics/technology/aritzia-nedap-rfid-enhances-store-operations-efficiency-1234791778/
ee8da6e3d769ca0df97ba314940fb9a5-0,ee8da6e3d769ca0df97ba314940fb9a5,ATZ,atz,2025-12-10T13:00:45Z,newsapi,news,,news,Gift of the Day: The World’s Most Versatile Cashmere Hoodie,0,,,"The best holiday gifts are the ones that are versatile enough to give to anyone on your list if you find yourself in a pinch, whether you get invited to a last-minute Secret Santa party or forget to … [+1275 chars]",http://www.thecut.com/article/gift-of-the-day-aritzia-cashmere-hoodie.html
7ec1e9450737c4ad4481ec624aee54b0-0,7ec1e9450737c4ad4481ec624aee54b0,ATZ,atz,2025-12-12T13:38:01Z,newsapi,news,,news,The best street-style outfits Taylor Swift has ever worn,0,,,"Taylor Swift in New York City on December 10, 2025.Patricia Schlein/Getty Images
<ul><li>Outside music, Taylor Swift is widely known for her sparkling red-carpet outfits and stage costumes.</li><li>… [+13319 chars]",https://www.businessinsider.com/taylor-swift-street-style-outfits-photos
0fed61e7630571098a8d4ec50d6cc30d-0,0fed61e7630571098a8d4ec50d6cc30d,ATZ,atz,2025-12-23T18:30:00Z,newsapi,news,,news,The Workout Sets We’ll Be Wearing on Repeat in 2026,0,,,"If youre anything like us, you might be planning to sweat out the final days of 2025 at the gym. Whether 2026 is your year to get stronger, try new workout classes, or simply move your body a little … [+723 chars]",https://www.eonline.com/news/1426523/cute-workout-sets-for-2026-that-will-actually-get-you-to-the-gym
be9c358e52f18bc4771341787867724a-0,be9c358e52f18bc4771341787867724a,ATZ,atz,2025-12-01T19:02:35Z,newsapi,news,,news,I’m Buying My Whole Winter Wardrobe During Cyber Monday,0,,,"Weve reached the point of the year between Thanksgiving and Christmas when the only thing I want to do is stay inside, watch my comfort shows, and wear comfy clothes. And when I do have to go outside… [+2616 chars]",http://www.thecut.com/article/best-cyber-monday-fashion-deals-2025.html
28a5cd5f900d1f264eb3708059937c2c-0,28a5cd5f900d1f264eb3708059937c2c,ATZ,atz,2025-12-01T14:41:03Z,newsapi,news,,news,"These Are the Best Cyber Week Deals, According to Cut Readers",0,,,"Usually our readers love a good beauty deal, but this past Cyber Weekend, you have surprised us. Our data shows youre a mixed bag this year. Yes, some of our beloved K-beauty products made the list a… [+1471 chars]",http://www.thecut.com/article/what-cut-readers-are-buying-cyber-weekend-2025.html
