id,report_id,ticker,company,date,source,doc_type,item,section_type,section_heading,chunk_index,page_start,page_end,text,source_file
9163fef0d904587ad036a6a51872e0cd-0,9163fef0d904587ad036a6a51872e0cd,LULU,lulu,2025-12-10T14:40:00Z,newsapi,news,,news,"Amazon initiated, GE Vernova upgraded: Wall Street's top analyst calls",0,,,"Guggenheim initiated coverage of Amazon.com(AMZN) with a Buy rating and $300 price target. The retail sector still seems to be perceived as ""structurally sick,"" but the firm says that ""holiday brough… [+680 chars]",https://finance.yahoo.com/news/amazon-initiated-ge-vernova-upgraded-144000835.html
ae18de901382d9c63a0eb769c332fa1d-0,ae18de901382d9c63a0eb769c332fa1d,LULU,lulu,2025-12-12T19:03:11Z,newsapi,news,,news,Wanted: New CEO with 'Growth Experience.' The Company: Lululemon.,0,,,"Sebastian Ng / SOPA Images / LightRocket via Getty Images
 Lululemon has launched a search for its next CEO.
<ul><li>Lululemon announced CEO Calvin McDonald is departing at the same time as its sea… [+3131 chars]",https://www.investopedia.com/wanted-new-ceo-lululemon-hunts-for-leader-to-head-its-recovery-effort-11868012
bf1d64ee89a7b968eeae02aa6581f6fa-0,bf1d64ee89a7b968eeae02aa6581f6fa,LULU,lulu,2025-12-09T13:39:59Z,newsapi,news,,news,Vision Capital Fund’s Views on Lululemon (LULU),0,,,"If you click 'Accept all', we and our partners, including 241 who are part of the IAB Transparency &amp; Consent Framework, will also store and/or access information on a device (in other words, use … [+714 chars]",https://consent.yahoo.com/v2/collectConsent?sessionId=1_cc-session_7847ee75-5292-4b53-ba53-0088c665f654
39a89450bc6cc55736366834324bd410-0,39a89450bc6cc55736366834324bd410,LULU,lulu,2025-12-03T04:51:39Z,newsapi,news,,news,Camp Mystic Is Reopening This Summer After Floods Killed 27 Campers and Counselors — Here Is Its Safety Plan,0,,,"NEED TO KNOW
<ul><li>On July 4, Camp Mystic was impacted by dangerous floods that killed 25 young girls, two counselors and the camps executive director
</li><li>Since then, Camp Mystic has announc… [+4571 chars]",https://people.com/camp-mystic-announces-safety-plan-ahead-of-reopening-after-floods-killed-27-campers-and-counselors-11860949
c8990e412db38ff58e5f0bf4d464e476-0,c8990e412db38ff58e5f0bf4d464e476,LULU,lulu,2025-12-12T00:07:14Z,newsapi,news,,news,"Calvin McDonald, Canadian-born Lululemon leader, to exit company in January",0,,,"Lululemon Athletica said that CEO Calvin McDonald was leaving the company without a replacement and raised its annual profit forecast, sending shares up about 10 per cent in extended trade on Thursda… [+2798 chars]",https://www.cbc.ca/news/business/lululemon-calvin-mcdonald-ceo-stepping-down-9.7012750
0d8a15b91e54aeb6526824f5b668bc67-0,0d8a15b91e54aeb6526824f5b668bc67,LULU,lulu,2025-12-09T15:45:00Z,newsapi,news,,news,Bleecker Street Acquires Horror-Comedy ‘Buzzkill’ Starring Billy Magnussen & Lulu Wilson,0,,,"Bleecker Street has locked down U.S. rights to Buzzkill, a new horror-comedy starring Billy Magnussen (Lilo &amp; Stitch) and Lulu Wilson (The Wrath of Becky) that shoots in Texas early next year. Th… [+1741 chars]",http://deadline.com/2025/12/billy-magnussen-buzzkill-acquired-bleecker-street-1236642749/
05b727d40fbff86767aa8b7f046be975-0,05b727d40fbff86767aa8b7f046be975,LULU,lulu,2025-12-13T12:01:01Z,newsapi,news,,news,"Lululemon (LULU) Soars 9.6% on Upbeat Outlook, Leadership Reshuffle",0,,,"We recently published 10 Big Names Leaving Wall Street in the Dust; 4 at Fresh Highs. Lululemon Athletica Inc. (NASDAQ:LULU) is one of the best performers on Friday.
Lululemon jumped by 9.60 percent… [+2266 chars]",https://finance.yahoo.com/news/lululemon-lulu-soars-9-6-120101550.html
816c284de50cdcdc027437c666cc7b17-0,816c284de50cdcdc027437c666cc7b17,LULU,lulu,2025-12-03T16:45:57Z,newsapi,news,,news,What Foods Are Meaningful to You?,0,,,"On this cold Wednesday morning, I’d love to ask: What foods are meaningful to you? Maybe because of your background, your friends, your family? “Food is symbolic of love when words are inadequate,” s… [+1442 chars]",https://cupofjo.com/2025/12/03/what-foods-are-meaningful-to-you/
d8ad026cd5d43bdf8c0e6790f5d0d0b3-0,d8ad026cd5d43bdf8c0e6790f5d0d0b3,LULU,lulu,2025-12-18T15:45:00Z,newsapi,news,,news,Activist investor Elliott Management acquires $1bn Lululemon stake,0,,,US-based Elliott Management has built a stake exceeding $1bn in Canadian retailer Lululemon Athletica.Reuters reports that the activist investor is preparing to push to change the companys CEO.The he… [+148 chars],https://biztoc.com/x/d1560e0d019544eb
cabe508eb5b5d9db1379cad50d093081-0,cabe508eb5b5d9db1379cad50d093081,LULU,lulu,2025-12-01T11:00:00Z,newsapi,news,,news,"Lululemon Has a Great Cyber Monday Sale, and We Found the Best Markdowns on Athleisure",0,,,"I JOINED THE MEN'S HEALTHstyle team in 2021, and in that time, a wave of new athleisure brands has flooded the market with moisture-wicking dress-shirts, stretchy chinos, and stink-fighting hoodies. … [+2392 chars]",https://www.menshealth.com/style/a69576801/lululemon-cyber-monday-sale-2025/
3ede72b05df9d11374a44b623b471f85-0,3ede72b05df9d11374a44b623b471f85,LULU,lulu,2025-12-12T11:07:07Z,newsapi,news,,news,McDonald Takes The Fall As Investors Sweat On Gloomy Lululemon Results,0,,,"Lululemon CEO Calvin McDonald is stepping down after six years in the top job. (Evan Buhler/The Canadian Press via AP)
The Canadian Press
For a decade, Lululemon defined and arguably created the mo… [+6760 chars]",https://www.forbes.com/sites/markfaithfull/2025/12/12/mcdonald-takes-the-fall-as-investors-sweat-on-gloomy-lululemon-results/
1fbb91b6f5b42928e6f5b90d9af1f775-0,1fbb91b6f5b42928e6f5b90d9af1f775,LULU,lulu,2025-12-10T23:35:26Z,newsapi,news,,news,"Stock market today: Nasdaq, S&P 500 slide, Dow gains as Oracle earnings stoke AI spending fears",0,,,"US stocks were mixed at the market open on Thursday after Oracle (ORCL) earnings revived AI overspending worries, risking the Wall Street rally that followed the Federal Reserves latest interest-rate… [+7232 chars]",https://finance.yahoo.com/news/live/stock-market-today-nasdaq-sp-500-slide-dow-gains-as-oracle-earnings-stoke-ai-spending-fears-233526960.html
bb94ed5867c7dc332dccd2be8f6b577c-0,bb94ed5867c7dc332dccd2be8f6b577c,LULU,lulu,2025-12-03T19:55:38Z,newsapi,news,,news,"Why Is Michael Burry So Bullish on Lululemon Stock? And Should You Be, Too?",0,,,"Michael Burry is an investor who isnt afraid to take a long position, even when it appears to be contrarian to the rest of the market. He was the investor who, starting in 2005, identified the risky … [+4437 chars]",https://www.barchart.com/story/news/36439055/why-is-michael-burry-so-bullish-on-lululemon-stock-and-should-you-be-too
5f0af7bfff30eed645f460e00d5eb341-0,5f0af7bfff30eed645f460e00d5eb341,LULU,lulu,2025-12-11T22:01:05Z,newsapi,news,,news,Lululemon's CEO is stepping down,0,,,"Lululemon's CEO is stepping down in January.credit should read CFOTO/Future Publishing via Getty ImagesCalvin McDonald, CEO of Lululemon, is stepping down from that role at the end of January, the co… [+148 chars]",https://biztoc.com/x/b82b0dd94c4d9340
f0a703846d3f0bd932dcd4736b8108c2-0,f0a703846d3f0bd932dcd4736b8108c2,LULU,lulu,2025-12-12T14:33:50Z,newsapi,news,,news,"Earnings live: Broadcom stock falls despite upbeat outlook, Lululemon pops, Costco dips",0,,,"A handful of remaining major companies reported their quarterly results this week, including Oracle (ORCL) and Broadcom (AVGO).
The Q3 earnings season has largely brought solid results. As of Dec. 5… [+18122 chars]",https://finance.yahoo.com/news/live/earnings-live-broadcom-stock-falls-despite-upbeat-outlook-lululemon-pops-costco-dips-143350526.html
f500d8c7357e424a96d9470b84289d2e-0,f500d8c7357e424a96d9470b84289d2e,LULU,lulu,2025-12-12T13:14:20Z,newsapi,news,,news,Lululemon Faces Leadership Change Amid Intensifying Athleisure Competition,0,,,"Lululemon is entering a major transition as CEO Calvin McDonald prepares to step down on Jan. 31 after a tough year of slowing sales and increasing competition in the athleisure market.
The company … [+2476 chars]",https://www.ibtimes.com/lululemon-faces-leadership-change-amid-intensifying-athleisure-competition-3792487
18ca12f31c658478eb45e6ffdc3b7d6c-0,18ca12f31c658478eb45e6ffdc3b7d6c,LULU,lulu,2025-12-12T11:19:48Z,newsapi,news,,news,Lululemon boss to step down early next year,0,,,"Michael RaceBusiness reporter
The boss of Lululemon Athletica, the brand known for its expensive yoga leggings and other sports clothing, is to leave the company early next year.
Calvin McDonald, t… [+3731 chars]",https://www.bbc.com/news/articles/cj388r2dl4ro
84b0cebd8fdb8b7f35496d773b500c8f-0,84b0cebd8fdb8b7f35496d773b500c8f,LULU,lulu,2025-12-11T16:34:00Z,newsapi,news,,news,Lululemon CEO Calvin McDonald to step down in January,0,,,"If you click 'Accept all', we and our partners, including 241 who are part of the IAB Transparency &amp; Consent Framework, will also store and/or access information on a device (in other words, use … [+714 chars]",https://consent.yahoo.com/v2/collectConsent?sessionId=1_cc-session_d74bfa00-0f9d-42d2-b630-efde3920c86f
7636c5f135d88e1c6edd2d5878728171-0,7636c5f135d88e1c6edd2d5878728171,LULU,lulu,2025-12-12T14:35:42Z,newsapi,news,,news,"Roblox downgraded, Lululemon upgraded: Wall Street's top analyst calls",0,,,"If you click 'Accept all', we and our partners, including 241 who are part of the IAB Transparency &amp; Consent Framework, will also store and/or access information on a device (in other words, use … [+714 chars]",https://consent.yahoo.com/v2/collectConsent?sessionId=1_cc-session_9b0aa7ec-678b-4f62-8b1a-cc606199b496
e8291fe005c1840ed2859819394afde1-0,e8291fe005c1840ed2859819394afde1,LULU,lulu,2025-12-18T22:18:39Z,newsapi,news,,news,"Will Money Talk? Elliott Takes $1 Billion Stake in Lululemon, Pushes for Ralph Lauren Exec to Be Next CEO",0,,,"Lululemon Athletica founder Chip Wilson has been agitating for change, and the outspoken critic now has activist investor Elliott Investment Management weighing in on a potential chief executive offi… [+4860 chars]",https://wwd.com/business-news/financial/activist-elliott-lululemon-jane-nielson-ceo-candidate-1238429663/
3820b0bcc699dcfd8fbf08ddf408a87a-0,3820b0bcc699dcfd8fbf08ddf408a87a,LULU,lulu,2025-12-18T11:14:00Z,newsapi,news,,news,Activist investor wants Ralph Lauren veteran to lead Lululemon,0,,,"If you click 'Accept all', we and our partners, including 242 who are part of the IAB Transparency &amp; Consent Framework, will also store and/or access information on a device (in other words, use … [+714 chars]",https://consent.yahoo.com/v2/collectConsent?sessionId=1_cc-session_1c5c6381-5a14-4ff5-b8e3-547f089f48b9
0ad0c329ccd2dd66408f8b9ade744b2e-0,0ad0c329ccd2dd66408f8b9ade744b2e,LULU,lulu,2025-12-13T06:10:45Z,newsapi,news,,news,Lululemon Stock Surges on CEO Shift. Why Investors Are Cheering the Change,0,,,"{ window.open(this.href, '_blank'); }, 200); return false;""&gt;Why did Lululemons CEO step down? { window.open(this.href, '_blank'); }, 200); return false;""&gt;How will Trumps AI executive order impa… [+708 chars]",https://biztoc.com/x/627fa30c11854e13
5154ae8012107fe1119adeee207d6970-0,5154ae8012107fe1119adeee207d6970,LULU,lulu,2025-12-10T23:35:26Z,newsapi,news,,news,"Stock market today: Dow gains while Nasdaq, S&P 500 slide as Oracle earnings revive AI spending fears",0,,,"US stocks traded mixed at the market open on Thursday, with a tumble for Oracle (ORCL) putting more tech-exposed gauges under pressure after its earnings revived AI overspending worries.
The Nasdaq … [+9051 chars]",https://finance.yahoo.com/news/live/stock-market-today-dow-gains-while-nasdaq-sp-500-slide-as-oracle-earnings-revive-ai-spending-fears-233526438.html
a3f4e81bc8212bd9a27e64518f164a28-0,a3f4e81bc8212bd9a27e64518f164a28,LULU,lulu,2025-12-12T13:03:14Z,newsapi,news,,news,Lululemon Stock Surge: $1B Buyback and CEO Exit Allegedly Protects Consumers,0,,,"Lululemon Athletica (Nasdaq: LULU), renowned for its premium leggings and athleisure, reported late Thursday a 7% increase in revenue for fiscal Q3 to $2.6 billion (£1.9 billion). However, diluted ea… [+3871 chars]",https://www.ibtimes.com/lululemon-stock-surge-1b-buyback-ceo-exit-allegedly-protects-consumers-3792472
2f1b6235baaba1bd0cea1879c2a0ddd8-0,2f1b6235baaba1bd0cea1879c2a0ddd8,LULU,lulu,2025-12-18T10:30:00Z,newsapi,news,,news,Be Your Best in 2026: The Most Important Lessons from The Knowledge Project (2025),0,,,"The Knowledge Project closes 2025 with a look back at the most meaningful conversations of the year. Featuring insights from some of our most impactful episodes, this collection brings together pract… [+730 chars]",https://fs.blog/knowledge-project-podcast/best-of-2025/
44b68dce108c8e360c1d9a14fc836c41-0,44b68dce108c8e360c1d9a14fc836c41,LULU,lulu,2025-12-18T16:14:00Z,newsapi,news,,news,Activist investor wants Ralph Lauren veteran to lead Lululemon,0,,,"Dive Brief:
<ul><li>Just days after Lululemon announced CEO Calvin McDonald would step down, Elliott Investment Management has acquired a more than $1 billion stake in the company and is pushing for… [+3082 chars]",https://www.retaildive.com/news/activist-investor-elliott-acquires-stake-lululemon-ceo-ralph-lauren-jane-nielsen/808265/
0d32b03480bd6da1eee60df3fb535da5-0,0d32b03480bd6da1eee60df3fb535da5,LULU,lulu,2025-12-13T12:12:19Z,newsapi,news,,news,Jeff Williams Joining Board Of Directors At Disney,0,,,"Jeff Williams, a former chief operating officer at Apple, might join the board of directors of Disney soon. Williams received nominations from the company’s board of directors to become an independen… [+754 chars]",https://www.ilounge.com/news/jeff-williams-joining-board-of-directors-at-disney
c8bb73a23669c7d76ef30577910cccd4-0,c8bb73a23669c7d76ef30577910cccd4,LULU,lulu,2025-12-13T11:54:39Z,newsapi,news,,news,Trump’s AI Bet Clouded by Unemployment and Inflation Fears,0,,,"{ window.open(this.href, '_blank'); }, 200); return false;""&gt;Why did Broadcom shares tumble recently? { window.open(this.href, '_blank'); }, 200); return false;""&gt;How will Trump's AI order affect… [+715 chars]",https://biztoc.com/x/5bee74501017a963
507813bac1a94eba516cb4c59bf08e12-0,507813bac1a94eba516cb4c59bf08e12,LULU,lulu,2025-12-13T12:39:03Z,newsapi,news,,news,New Yorkers Can’t Shut Up About DC’s Flaws,0,,,"{ window.open(this.href, '_blank'); }, 200); return false;""&gt;Why did Broadcom shares tumble recently? { window.open(this.href, '_blank'); }, 200); return false;""&gt;How will Trump's AI order affect… [+699 chars]",https://biztoc.com/x/4c12da70b2d2c28f
561311222de7700e218410d55caad65d-0,561311222de7700e218410d55caad65d,LULU,lulu,2025-12-12T14:13:25Z,newsapi,news,,news,"Here Are Friday’s Top Wall Street Analyst Research Calls: Bristol-Myers Squibb, Citigroup, Lululemon Athletica, PayPal, Roblox, Soundhound AI, and More",0,,,"Thinkstock
<ul><li>With just over two weeks remaining in 2025, we could see the third straight year of double-digit gains for the S&amp;P 500.
</li><li>All of the major indices including the Russel… [+6841 chars]",https://247wallst.com/investing/2025/12/12/here-are-fridays-top-wall-street-analyst-research-calls-bristol-myers-squibb-citigroup-lululemon-athletica-paypal-roblox-soundhound-ai-and-more/
ef6c5fb4c1d1e2fe02fb87ed4de8c99a-0,ef6c5fb4c1d1e2fe02fb87ed4de8c99a,LULU,lulu,2025-12-12T22:43:41Z,newsapi,news,,news,Lululemon’s CEO Faced Mounting Pressure. Then Came the Attack Ad,0,,,"{ window.open(this.href, '_blank'); }, 200); return false;""&gt;Why is Broadcom stock tumbling despite strong earnings? { window.open(this.href, '_blank'); }, 200); return false;""&gt;How will Trump's … [+769 chars]",https://biztoc.com/x/c84b714989cc1a6c
4bd97083dcbe164d7a31738f76cec336-0,4bd97083dcbe164d7a31738f76cec336,LULU,lulu,2025-12-12T17:52:40Z,newsapi,news,,news,"Sources: X reported $752M in Q3 revenue, up 17% YoY, a net loss of $577.4M, and EBITDA of ~$454M, up 16%; revenue for the first nine months of 2025 was $2B+",0,,,"{ window.open(this.href, '_blank'); }, 200); return false;""&gt;Why did Broadcom stock plunge after earnings? { window.open(this.href, '_blank'); }, 200); return false;""&gt;How will Trump's AI executi… [+761 chars]",https://biztoc.com/x/a06f3522fd38073b
3f2bd7e2f565c318145294e45c5b0835-0,3f2bd7e2f565c318145294e45c5b0835,LULU,lulu,2025-12-12T17:52:16Z,newsapi,news,,news,Gemini Space Station Is Launching a Prediction Markets Business. Should You Buy GEMI Stock Here?,0,,,"{ window.open(this.href, '_blank'); }, 200); return false;""&gt;Why did Broadcom stock plunge after earnings? { window.open(this.href, '_blank'); }, 200); return false;""&gt;How will Trump's AI executi… [+791 chars]",https://biztoc.com/x/34b40cefc5574a1b
f039b824b6affeaeea0e6a44ce42c1b5-0,f039b824b6affeaeea0e6a44ce42c1b5,LULU,lulu,2025-12-01T19:45:45Z,newsapi,news,,news,I Found the Cyber Deals That Double As Great Gifts,0,,,"If youve done all the shopping you can for yourself (no judgment here), its time to consider gifting. The holidays will creep up on you, but if you start now, you can skip the expedited shipping. Cyb… [+2953 chars]",http://www.thecut.com/article/best-cyber-monday-gift-ideas-2025.html
d249bfc651fcc0c249ce2237f4ea922f-0,d249bfc651fcc0c249ce2237f4ea922f,LULU,lulu,2025-12-10T23:35:26Z,newsapi,news,,news,"Stock market today: Dow, S&P 500, Nasdaq futures slip as Oracle earnings stoke AI spending fears",0,,,"US stock futures fell on Thursday after Oracle (ORCL) earnings revived AI overspending worries, risking the Wall Street rally that followed the Federal Reserves latest interest-rate cut.
Contracts o… [+7195 chars]",https://finance.yahoo.com/news/live/stock-market-today-dow-sp-500-nasdaq-futures-slip-as-oracle-earnings-stoke-ai-spending-fears-233526371.html
52c2f9f8b19eff200851ecb1b4d28d95-0,52c2f9f8b19eff200851ecb1b4d28d95,LULU,lulu,2025-12-10T21:37:42Z,newsapi,news,,news,The Best Gym-Girl-Approved Fitness Gifts of the Year,0,,,"We all know that if you look good, youll automatically run faster, lift heavier, Pilates harder, etc. Not to mention, nothing is more motivating than the thought of wearing new workout clothes or acc… [+2187 chars]",http://www.thecut.com/article/best-fitness-gifts.html
e93df8e39c13915e7b74efb518cc927d-0,e93df8e39c13915e7b74efb518cc927d,LULU,lulu,2025-12-01T18:11:06Z,newsapi,news,,news,How Was Your Weekend?,0,,,"“Would you ever consider a Monday update?” a reader named Molly commented last week. “It could be a mini complement to the ‘Have a Great Weekend’ posts. I’m always curious how the party went, which d… [+3111 chars]",https://cupofjo.com/2025/12/01/joanna-thanksgiving-brooklyn/
0fb2ef1008b2d2ad005cdbcf3e4018f0-0,0fb2ef1008b2d2ad005cdbcf3e4018f0,LULU,lulu,2025-12-24T15:29:00Z,newsapi,news,,news,"Lululemon Is a Good Fit for 2026: Limited Downside, Ample Upside",0,,,"If you click 'Accept all', we and our partners, including 244 who are part of the IAB Transparency &amp; Consent Framework, will also store and/or access information on a device (in other words, use … [+714 chars]",https://consent.yahoo.com/v2/collectConsent?sessionId=1_cc-session_7ba410f7-0f83-4451-9149-a5c3b1050892
11ae838baf086e828ce7853155a56ef0-0,11ae838baf086e828ce7853155a56ef0,LULU,lulu,2025-12-09T23:51:10Z,newsapi,news,,news,"Stock market today: Dow, S&P 500, Nasdaq futures slip with Fed rate decision on deck",0,,,"US stock futures held around the baseline Wednesday morning as Wall Street waited for the Federal Reserves final policy decision of the year.
Dow Jones Industrial Average futures (YM=F), contracts t… [+3558 chars]",https://finance.yahoo.com/news/live/stock-market-today-dow-sp-500-nasdaq-futures-slip-with-fed-rate-decision-on-deck-235110185.html
1c9eb614d497bef7e9386583be37e95f-0,1c9eb614d497bef7e9386583be37e95f,LULU,lulu,2025-12-17T18:40:12Z,newsapi,news,,news,MicroStrategy Gets to Stay in the Nasdaq-100. Does It Deserve to Stay in Your Portfolio Too?,0,,,"There are a myriad of upside catalysts investors look to as reasons to buy stocks. Whether it's an earnings beat, or a big announcement, or something like a stock split or index inclusion, there are … [+3860 chars]",https://www.barchart.com/story/news/36674217/microstrategy-gets-to-stay-in-the-nasdaq-100-does-it-deserve-to-stay-in-your-portfolio-too
84543deb45bcf91449e4f521bf8b82c6-0,84543deb45bcf91449e4f521bf8b82c6,LULU,lulu,2025-12-15T23:00:00Z,newsapi,news,,news,"Shop Now, Get It in Time: Your Guide to Christmas Shipping Cutoffs",0,,,"So you didn't beat the holiday rush and now you're scrambling to find a gift that will arrive on time. Don't worry, weve got you covered.
This handy guide includes shipping cut-off dates for major c… [+676 chars]",https://www.eonline.com/news/1426212/christmas-shipping-deadlines-gifts-you-can-still-order-on-time
8f8810b4a79a2f406b1efc5a882b7701-0,8f8810b4a79a2f406b1efc5a882b7701,LULU,lulu,2025-12-12T08:41:00Z,newsapi,news,,news,"React2Shell Exploitation Escalates into Large-Scale Global Attacks, Forcing Emergency Mitigation",0,,,"The U.S. Cybersecurity and Infrastructure Security Agency (CISA) has urged federal agencies to patch the recent React2Shell vulnerability by December 12, 2025, amid reports of widespread exploitation… [+4043 chars]",https://thehackernews.com/2025/12/react2shell-exploitation-escalates-into.html
0211537900229af76aaa5ee8dbc8dc8f-0,0211537900229af76aaa5ee8dbc8dc8f,LULU,lulu,2025-12-10T23:35:26Z,newsapi,news,,news,"Stock market today: Dow hits record high while Nasdaq, S&P 500 slide as Oracle earnings revive AI spending fears",0,,,"The Dow surged to a record on Thursday as US stocks diverged, with more tech-exposed gauges under pressure after Oracle (ORCL) earnings revived AI overspending worries.
The Nasdaq Composite (^IXIC) … [+12115 chars]",https://finance.yahoo.com/news/live/stock-market-today-dow-hits-record-high-while-nasdaq-sp-500-slide-as-oracle-earnings-revive-ai-spending-fears-233526385.html
ef9251f4944814f39121d294a36086c6-0,ef9251f4944814f39121d294a36086c6,LULU,lulu,2025-12-19T20:25:19Z,newsapi,news,,news,Downtown Disney’s Newest Store Is Open EARLY,0,,,"Activewear fans are going to be VERY happy today, especially if they’re located near Disneyland Resort, or plan to visit soon!
©lululemon
We’ve been anxiously awaiting the opening of Lululemon in D… [+2091 chars]",https://www.disneyfoodblog.com/2025/12/19/downtown-disneys-newest-store-is-open-early/
e51cb7afac5b01ccd23a539e271d54f2-0,e51cb7afac5b01ccd23a539e271d54f2,LULU,lulu,2025-12-19T13:54:57Z,newsapi,news,,news,Universal Tower Defense Lulu guide,0,,,"There are plenty of units in UTD, but few have the same impact as Universal Tower Defense's Lulu, a secret character that takes some considerable effort to get your hands on. Mind you, he's more than… [+3579 chars]",https://www.pockettactics.com/universal-tower-defense-lulu
0616fd84087caa965afcf5031a636760-0,0616fd84087caa965afcf5031a636760,LULU,lulu,2025-12-19T13:00:00Z,newsapi,news,,news,Friday favorites + much better in person,0,,,"(shirt, leggings)
For any other lululemon-obsessed humans, don’t go off the Sinatra Blue picture online… it is so much better in person. It’s my new favorite.
9 miles @ 8:18 pace and back before al… [+2497 chars]",https://hungryrunnergirl.com/2025/12/friday-favorites-320.html
4cf866f5b36ca784488ff4688df13aba-0,4cf866f5b36ca784488ff4688df13aba,LULU,lulu,2025-12-10T12:17:23Z,newsapi,news,,news,Lululemon Stock Turmoil: Founder Blames CEO as Brand Identity Crisis Sparks Investor Frenzy,0,,,Lululemon spent more than a decade as one of the world's fastest-growing retail success stories. The brand built an empire on premium activewear and an image that blended athletic discipline with lif… [+3692 chars],https://www.ibtimes.com/lululemon-stock-turmoil-founder-blames-ceo-brand-identity-crisis-sparks-investor-frenzy-3792250
9386e93b68605c1f446bdf5a3f5f8a71-0,9386e93b68605c1f446bdf5a3f5f8a71,LULU,lulu,2025-12-22T16:39:00Z,newsapi,news,,news,Lululemon to enter 6 new markets in 2026,0,,,"Dive Brief:
<ul><li>As its sales outside the U.S. continue to grow, Lululemon announced plans to expand into six new markets next year, including Greece, Austria, Poland, Hungary, Romania and India.… [+1782 chars]",https://www.retaildive.com/news/lululemon-enters-six-international-markets-greece-austria-india-2026/808480/
14375a1c418d5958340592a6e4bd6303-0,14375a1c418d5958340592a6e4bd6303,LULU,lulu,2025-12-12T16:55:00Z,newsapi,news,,news,Lululemon founder decries brand ‘erosion’ as CEO prepares to exit,0,,,"Lululemon announced the end of a seven-year-long tenure Thursday with the exit of CEO Calvin McDonald. Going forward, the company is looking for a CEO with experience in growth and transformation, CF… [+5858 chars]",https://www.retaildive.com/news/lululemon-founder-chip-wilson-brand-erosion-ceo-calvin-mcdonald-exits/807787/
e57ea8761d73bcd1d0d076f9098c63a5-0,e57ea8761d73bcd1d0d076f9098c63a5,LULU,lulu,2025-12-13T17:23:19Z,newsapi,news,,news,Michael Saylor's Strategy Hangs on to Spot in Nasdaq 100 Index,0,,,"Bitcoin-heavy firm Strategy (MSTR) will remain in the Nasdaq 100 index, surviving the annual reshuffle that saw several household names dropped.
The firm, which began as business software provider M… [+1439 chars]",https://www.coindesk.com/business/2025/12/13/michael-saylor-s-strategy-hangs-on-to-spot-in-nasdaq-100-index
