id,report_id,ticker,company,date,source,doc_type,item,section_type,section_heading,chunk_index,page_start,page_end,text,source_file
839b782f1fb4426defeea9c4e7ea4032-0,839b782f1fb4426defeea9c4e7ea4032,ATZ,atz,2025-12-01T08:30:00Z,newsapi,news,,news,"Aritzia, UGG, and more are dropping Cyber Monday fashion deals worth catching",0,,,"New York Post may be compensated and/or receive an affiliate commission if you click or buy through our links. Featured pricing is subject to change.
Cyber Week is the ultimate shopping moment, and … [+17351 chars]",https://nypost.com/shopping/cyber-monday-is-the-best-time-to-shop-clothing-deals-up-to-75-off/
dd8767169b1618e78ab4b345cac66eea-0,dd8767169b1618e78ab4b345cac66eea,ATZ,atz,2025-12-20T11:01:00Z,newsapi,news,,news,Mom? Wife? West Village girl? Just get her the $54 puffer that’s giving Aritzia vibes,0,,,"New York Post may be compensated and/or receive an affiliate commission if you click or buy through our links. Featured pricing is subject to change.
So you forgot to get her something for Christmas… [+2134 chars]",https://nypost.com/2025/12/20/shopping/this-54-amazon-puffer-gives-aritzia-vibes-and-ships-in-two-days/
c91dc654286d1ad4d8800c4ed6b8cc97-0,c91dc654286d1ad4d8800c4ed6b8cc97,ATZ,atz,2025-12-16T08:39:03Z,newsapi,news,,news,Aritzia: Global Demand Waiting To Be Tapped,0,,,"{ window.open(this.href, '_blank'); }, 200); return false;""&gt;Why did Ben &amp; Jerrys remove board members? { window.open(this.href, '_blank'); }, 200); return false;""&gt;How is Fords EV retreat af… [+722 chars]",https://biztoc.com/x/97ebadb34462cfec
401c77cf976a67577ba11eed38b8a9a4-0,401c77cf976a67577ba11eed38b8a9a4,ATZ,atz,2025-12-19T15:30:55Z,newsapi,news,,news,Aritzia price target raised by C$3 at BMO Capital,0,,,"Earnings calls, analyst events, roadshows and more",https://thefly.com/permalinks/entry.php/id4260369/ATZAF-Aritzia-price-target-raised-by-C-at-BMO-Capital
a16600c871f3e7e8bbec56d0990d88f9-0,a16600c871f3e7e8bbec56d0990d88f9,ATZ,atz,2025-12-12T10:52:03Z,newsapi,news,,news,"Aritzia initiated with neutral view at Wells Fargo, here's why",0,,,"Earnings calls, analyst events, roadshows and more",https://thefly.com/permalinks/entry.php/id4255498/ATZAF-Aritzia-initiated-with-neutral-view-at-Wells-Fargo-heres-why
c1145b85f9854125fdc7fb81dd122e31-0,c1145b85f9854125fdc7fb81dd122e31,ATZ,atz,2025-12-11T09:51:36Z,newsapi,news,,news,"Aritzia initiated with bullish view at Goldman Sachs, here's why",0,,,"Earnings calls, analyst events, roadshows and more",https://thefly.com/permalinks/entry.php/id4254389/ATZAF-Aritzia-initiated-with-bullish-view-at-Goldman-Sachs-heres-why
5a1c56b99f310c4e798b15698b29c98d-0,5a1c56b99f310c4e798b15698b29c98d,ATZ,atz,2025-12-14T23:00:00Z,newsapi,news,,news,Cocoon Coats: The Winter Layering Hero,0,,,"If youre someone who loves a chunky knit sweater, or you like to elevate your hoodies with a cool jacket as much as we do…Shana and I bring you: cocoon coats. 
Plenty of brands say cocoon coat,” but… [+3905 chars]",https://themomedit.com/best-cocoon-coats-winter-layering/
2f1a0267b27afc727693e65b74ba231d-0,2f1a0267b27afc727693e65b74ba231d,ATZ,atz,2025-12-03T19:23:16Z,newsapi,news,,news,Where Maggi Simpkins Gets Her Vintage Jewelry,0,,,"Jewelry designer Maggi Simpkins is sentimental, she tells The Cut over a call. Simpkins works with fine materials to create custom and often viral pieces. (Her ring for Sothebys cost $1 million after… [+6794 chars]",http://www.thecut.com/article/where-maggi-simpkins-gets-her-vintage-jewelry.html
09f917a1bd1775a447e9575728c3a3a0-0,09f917a1bd1775a447e9575728c3a3a0,ATZ,atz,2025-12-04T18:02:21Z,newsapi,news,,news,Aritzia founder calls for Ottawa to scrap duty-free imports to help Canadian retailers compete at home,0,,,"The founder and executive chair of 
Vancouver-based retailerAritzia Inc.
said Canada needs to follow the American lead in lowering the limit on the 
duty-free shopping exemption
. Brian Hill, who… [+72 chars]",https://biztoc.com/x/3c94da5bbe19e33d
ec81c633d400b47904fbcbde82da38a8-0,ec81c633d400b47904fbcbde82da38a8,ATZ,atz,2025-12-05T17:59:29Z,newsapi,news,,news,Tech Tactics: Aritzia Taps Nedap’s RFID Platform to Strengthen Store Operations,0,,,Tech Tactics is Sourcing Journals series with brands and technology companies to discuss their latest innovations.Aritzia is taking a more precise approach to managing its inventory.More from Sourcin… [+147 chars],https://biztoc.com/x/5edca6cd33131f8d
d196ab2dc52b8da0b3028aa7f496dcfc-0,d196ab2dc52b8da0b3028aa7f496dcfc,ATZ,atz,2025-12-04T17:53:31Z,newsapi,news,,news,Aritzia founder calls for Ottawa to scrap duty-free imports to help Canadian retailers compete at home,0,,,"The founder and executive chair of Vancouver-based retailerAritzia Inc. said Canada needs to follow the American lead in lowering the limit on the duty-free shopping exemption.
THIS CONTENT IS RESER… [+5275 chars]",https://financialpost.com/news/aritzia-founder-calls-canada-raise-import-duties
366b89a77d0309b6bdf2eb47a1e6835f-0,366b89a77d0309b6bdf2eb47a1e6835f,ATZ,atz,2025-12-04T17:53:31Z,newsapi,news,,news,Aritzia founder calls for Ottawa to scrap duty-free imports to help Canadian retailers compete at home,0,,,"The founder and executive chair of Vancouver-based retailerAritzia Inc. said Canada needs to follow the American lead in lowering the limit on the duty-free shopping exemption.
THIS CONTENT IS RESER… [+5275 chars]",https://financialpost.com/news/aritzia-founder-calls-for-canada-to-follow-u-s-lead-and-raise-import-duties
bd4a9bbf51544ddc999eb5f498c7363c-0,bd4a9bbf51544ddc999eb5f498c7363c,ATZ,atz,2025-12-19T12:25:36Z,newsapi,news,,news,I needed a wardrobe makeover — could an AI ‘stylist’ save me?,0,,,"It’s one of the most annoying dilemmas women face wanting to look stylish at work, on weekends and on nights out, but getting stuck in a rut.
At the same time, finding the budget for standout pieces… [+9344 chars]",https://nypost.com/2025/12/19/lifestyle/i-needed-a-wardrobe-makeover-could-an-ai-stylist-save-me/
b83f2f264261f4f580fdf6df60c89c1d-0,b83f2f264261f4f580fdf6df60c89c1d,ATZ,atz,2025-12-01T13:30:00Z,newsapi,news,,news,"Shop Page Six editors’ favorite Cyber Monday deals, from an $18 ring to an ‘adorable dress’",0,,,"Page Six may receive revenue from affiliate and advertising partnerships for sharing this content and/or when you make a purchase.
Want to shop sales like a pro?
We asked the Page Six team what the… [+11380 chars]",https://pagesix.com/2025/12/01/style/heres-everything-page-six-editors-are-shopping-on-cyber-monday/
985d759b5df78bd636e03b28855395fc-0,985d759b5df78bd636e03b28855395fc,ATZ,atz,2025-12-22T13:58:54Z,newsapi,news,,news,These were the investing winners and losers that made or crushed portfolios in 2025,0,,,"OpenAIs ChatGPT was the first artificial intelligence chatbot to capture the publics imagination, but it looks like Google parent Alphabet Inc. (Nasdaq/GOOG) is rapidly closing the gap. Alphabet lapp… [+4360 chars]",https://financialpost.com/investing/investing-winners-losers-crushed-portfolios-2025
0371ddf4a0b89ef16a5988d042ba1d17-0,0371ddf4a0b89ef16a5988d042ba1d17,ATZ,atz,2025-12-10T12:00:00Z,newsapi,news,,news,Inside tractor maker CNH’s push to bring more artificial intelligence to the farm,0,,,"Jay Schroeder, the chief technology officer of CNH, was recently in Brazil, discussing artificial intelligence use cases to support the companys research and development team. The agricultural equipm… [+13608 chars]",https://fortune.com/2025/12/10/artificial-intelligence-cnh-ai-tractors-farm-equipment/
c72dc3d3768420225c6a01de856cda7a-0,c72dc3d3768420225c6a01de856cda7a,ATZ,atz,2025-12-24T00:00:00Z,newsapi,news,,news,Retailers With Last-Minute Gifts You Can Buy Online & Pickup in Store,0,,,"Still need to grab a gift or two? Don't panic, and don't pay for express shipping either!
Many of your favorite retailers offer buy online, pickup in store options so you don't even have to worry ab… [+755 chars]",https://www.eonline.com/news/1426539/12-retailers-for-last-minute-holiday-gifts-online-pickup-in-store
08b1de84d601e5dd43347f2b8cd5dc8d-0,08b1de84d601e5dd43347f2b8cd5dc8d,ATZ,atz,2025-12-22T11:02:01Z,newsapi,news,,news,5 big changes Nike CEO Elliott Hill is making to turn around the struggling sportswear giant,0,,,"Nike CEO Elliott Hill inherited an uphill battle when he took over at the sports giant in October 2024.
Since then, Hill has made changes both big and small to the company as part of its turnaround … [+5259 chars]",https://www.businessinsider.com/nike-ceo-elliott-hills-biggest-changes-struggling-sportswear-brand-2025-12
dfe18741639ea53de7abec16dd5af445-0,dfe18741639ea53de7abec16dd5af445,ATZ,atz,2025-12-01T14:01:06Z,newsapi,news,,news,I've covered Cyber Monday for 6 years — these are the 319+ absolute best deals of 2025,0,,,"Don't wait any longer to add that Apple MacBook, Skims bodysuit, Owala water bottle or Dyson vacuum to your cart. Cyber Monday sales are live across hundreds of retailers, which means today is offici… [+43873 chars]",https://www.nbcnews.com/select/shopping/best-cyber-monday-deals-live-2025-rcna245873
9a7db9c578eea633182cdc10fd389b92-0,9a7db9c578eea633182cdc10fd389b92,ATZ,atz,2025-12-01T07:47:22Z,newsapi,news,,news,"Once they're gone, they're gone: These are the 293+ absolute best Cyber Monday 2025 deals",0,,,"Your absolute last chance to shop the best deals of 2025 is officially here. Cyber Monday sales are live across almost every retailer you can think of, so stop waiting to add that Dyson vacuum, PlayS… [+41539 chars]",https://www.nbcnews.com/select/shopping/best-cyber-monday-deals-sales-2025-rcna245873
0536304da85b371f938fc0a1aa3bf693-0,0536304da85b371f938fc0a1aa3bf693,ATZ,atz,2025-12-01T07:15:17Z,newsapi,news,,news,The 94+ best Walmart Cyber Monday deals,0,,,"Cyber Monday is almost over, but Walmart has notable deals running right up until midnight. Youll find sales on beauty, tech, home and kitchen and more, but dont wait to shop many of them end tonight… [+13696 chars]",https://www.nbcnews.com/select/shopping/walmart-cyber-monday-deals-2025-rcna246569
badd6468b25f87dd997dc7c20c8f0d8a-0,badd6468b25f87dd997dc7c20c8f0d8a,ATZ,atz,2025-12-19T21:08:10Z,newsapi,news,,news,"Shoppers are focusing on quality, not deals, in the final days before Christmas",0,,,"While discounts drive purchasing in the early days of the holiday shopping season, consumers are shifting into more thoughtful, quality gifts in the back half of the season as total spending growth s… [+5928 chars]",https://www.cnbc.com/2025/12/19/christmas-shoppers-focus-on-quality-rather-than-deals.html
60b9db0ab4e0b8b1293cb157ac0b803e-0,60b9db0ab4e0b8b1293cb157ac0b803e,ATZ,atz,2025-12-10T05:01:00Z,newsapi,news,,news,Hudson Yards Remakes Its Retail Mix,0,,,"It’s a new day for The Shops &amp; Restaurants at Hudson Yards.
Retail square footage has been reduced and converted to additional office space. Several stores and restaurants have opened in recent … [+12265 chars]",http://wwd.com/business-news/real-estate/hudson-yards-transforms-its-retail-mix-1238365907/
b3b75588e288c648d64cf330a0e03437-0,b3b75588e288c648d64cf330a0e03437,LULU,lulu,2025-12-18T20:10:30Z,newsapi,news,,news,Willow and Charlotte Need to Apologize STAT on General Hospital,0,,,"Parent-child relationships are complicated all over the world, but especially on General Hospital. And mother-daughter relationships are particularly challenging. But GHs Willow and Charlotte are mak… [+2370 chars]",https://soaphub.com/general-hospital/news-gh/willow-charlotte-apologize-stat/
11268ed4af6cdb316b27ab92218f90e0-0,11268ed4af6cdb316b27ab92218f90e0,LULU,lulu,2025-12-12T05:01:11Z,newsapi,news,,news,Lululemon is dialing back the in-store clutter,0,,,"Lululemon's executives said the company would be improving its in-store experience.Joe Raedle/Getty Images
<ul><li>Lululemon is making changes to its inventory-packed stores.</li><li>Company executi… [+2420 chars]",https://www.businessinsider.com/lululemon-earnings-fixing-store-clutter-problem-2025-12
6f9d5c54f5353d52bf0a2a00c0280018-0,6f9d5c54f5353d52bf0a2a00c0280018,LULU,lulu,2025-12-10T23:35:26Z,newsapi,news,,news,"Stock market today: Dow, S&P 500, Nasdaq futures tumble after Fed decision as Oracle earnings fall short",0,,,"US stock futures dived on Thursday as investors evaluated the Federal Reserves latest rate cut, which helped fuel a late-day rally on Wall Street.
Contracts on the S&amp;P 500 (ES=F) and the Nasdaq … [+1524 chars]",https://finance.yahoo.com/news/live/stock-market-today-dow-sp-500-nasdaq-futures-tumble-after-fed-decision-as-oracle-earnings-fall-short-233526540.html
af4adc5b49f6196e28ec32ccec4f1afd-0,af4adc5b49f6196e28ec32ccec4f1afd,LULU,lulu,2025-12-10T23:35:26Z,newsapi,news,,news,"Stock market today: Dow, S&P 500, Nasdaq futures plummet after Fed decision as Oracle sinks after earnings",0,,,"US stock futures fell Wednesday night as investors evaluated the Federal Reserves latest rate cut, which helped fuel a late-day rally on Wall Street.
Dow Jones Industrial Average futures (YM=F) edge… [+1414 chars]",https://finance.yahoo.com/news/live/stock-market-today-dow-sp-500-nasdaq-futures-plummet-after-fed-decision-as-oracle-sinks-after-earnings-233526664.html
f4464a70909bc64f01f237e1c2c9ec73-0,f4464a70909bc64f01f237e1c2c9ec73,LULU,lulu,2025-12-27T18:51:51Z,newsapi,news,,news,"Lululemon's extended Boxing Day sale includes $24 belt bags, 50% off shoulder bags, discounted totes and more",0,,,"Boxing Day may be over, but Lululemon's Boxing Week sale still has 100s of deals up for grabs, including on dozens of the brand's most-wanted and most-gifted accessories. While supplies last (and hur… [+809 chars]",https://ca.style.yahoo.com/lululemons-extended-boxing-day-sale-includes-24-belt-bags-50-off-shoulder-bags-discounted-totes-and-more-185151761.html
6ea2f0a6797fb281d0e0105b53f2d24e-0,6ea2f0a6797fb281d0e0105b53f2d24e,LULU,lulu,2025-12-01T11:45:00Z,newsapi,news,,news,Hidden In Rocky Mountain National Park Is Colorado's Once-Thriving Boomtown That's Now A Secret Ghost Village,0,,,"For the inquisitive minds and history buffs, Colorado has always possessed an insatiable allure. This is because of its fair share of abandoned mining settlements filled with crumbling buildings and … [+5086 chars]",https://www.islands.com/2037323/lulu-city-colorado-enchanting-ghost-village-secret-boomtown-once-thriving-rocky-mountain-national-park/
0d0523ab1c7622383052917335965b8e-0,0d0523ab1c7622383052917335965b8e,LULU,lulu,2025-12-09T22:01:32Z,newsapi,news,,news,Former Apple COO Jeff Williams Joining Disney's Board of Directors,0,,,"Former Apple chief operating officer Jeff Williams may soon join Disney's board of directors. The Walt Disney Company Board of Directors nominated Williams to be a new independent director, and he wi… [+1132 chars]",https://www.macrumors.com/2025/12/09/jeff-williams-disney-board/
a32a491d80746f39eb66376994ed6c4e-0,a32a491d80746f39eb66376994ed6c4e,LULU,lulu,2025-12-12T14:32:30Z,newsapi,news,,news,RSF commander linked by BBC Verify to Sudan massacre sanctioned in UK,0,,,"A Sudanese paramilitary commander, whose role in the el-Fasher massacre was revealed by BBC Verify, has been sanctioned by the UK government.
Brig Gen Al-Fateh Abdullah Idris, also known as Abu Lulu… [+3984 chars]",https://www.bbc.com/news/articles/c0jeeq6xnvpo
a7df8cd8ddf87f2a03e8a2f9da775f96-0,a7df8cd8ddf87f2a03e8a2f9da775f96,LULU,lulu,2025-12-10T23:35:26Z,newsapi,news,,news,"Stock market today: Dow, S&P 500, Nasdaq futures slump as Oracle earnings reignite AI spending fears",0,,,"US stock futures sank on Thursday as Oracle (ORCL) earnings revived worries about the AI trade, taking the wind out of the Wall Street rally that followed the Federal Reserves latest rate cut.
Contr… [+2832 chars]",https://finance.yahoo.com/news/live/stock-market-today-dow-sp-500-nasdaq-futures-slump-as-oracle-earnings-reignite-ai-spending-fears-233526300.html
f2a7a2077a29657aef0b8ffb860f1c2b-0,f2a7a2077a29657aef0b8ffb860f1c2b,LULU,lulu,2025-12-19T15:49:51Z,newsapi,news,,news,Nike is struggling to stay culturally relevant in China,0,,,"Pedestrians walk past a Nike store in China.Cheng Xin/Getty Images
<ul><li>Nike's sales in Greater China fell 17% in its most recent quarter.</li><li>Nike CEO Elliott Hill acknowledged the slump, sa… [+3530 chars]",https://www.businessinsider.com/nike-sales-decline-china-losing-cultural-relevance-2025-12
e128ec84226968ed278d051a73918331-0,e128ec84226968ed278d051a73918331,LULU,lulu,2025-12-10T23:35:26Z,newsapi,news,,news,"Stock market today: Dow vaults toward record high as Oracle's slide weighs on S&P 500, Nasdaq",0,,,"The Dow surged toward a record on Thursday as US stocks diverged, with more tech-exposed gauges under pressure after Oracle (ORCL) earnings revived AI overspending worries.
The Nasdaq Composite (^IX… [+15496 chars]",https://finance.yahoo.com/news/live/stock-market-today-dow-vaults-toward-record-high-as-oracles-slide-weighs-on-sp-500-nasdaq-233526728.html
2fb04f665e1a9ad2b3eb8777335ea461-0,2fb04f665e1a9ad2b3eb8777335ea461,LULU,lulu,2025-12-27T09:25:03Z,newsapi,news,,news,"Lululemon (LULU) “is Challenged,” Says Jim Cramer",0,,,"We recently published 9 Stocks Jim Cramer Talked About.  Lululemon Athletica Inc. (NASDAQ:LULU) is one of the stocks on Jim Cramer talked about.
Lululemon Athletica Inc. (NASDAQ:LULU) is a Canadian … [+1885 chars]",https://finance.yahoo.com/news/lululemon-lulu-challenged-says-jim-092503159.html
aa2d313e64315ebac84a441f78c08afd-0,aa2d313e64315ebac84a441f78c08afd,LULU,lulu,2025-12-18T19:51:25Z,newsapi,news,,news,"Elliott Investment takes $1-billion stake in Lululemon, pushes for new CEO",0,,,"One of the worlds largest activist funds, New York-based Elliott Investment Management, has taken a more than US$1-billion stake in Lululemon Athletica Inc. LULU-Q, and is pushing for a CEO candidate… [+152 chars]",https://biztoc.com/x/d449345c417f61d9
e8e2eab60f7726d1415029dea1844199-0,e8e2eab60f7726d1415029dea1844199,LULU,lulu,2025-12-01T00:43:27Z,newsapi,news,,news,Women's lululemon Wunder Under SmoothCover Tight Leggings (various colors/sizes) $49 + Free S/H,0,,,"Update: This front page deal is still available.lululemon has Women's lululemon Wunder Under SmoothCover High-Rise Tight Leggings (various colors/sizes) for $49. Shipping is free.
Thanks to Deal Hun… [+117 chars]",https://slickdeals.net/f/18881401-women-s-lululemon-wunder-under-smoothcover-tight-leggings-various-colors-sizes-49-free-s-h
2e0d40610309f15c151329ec04ca5b71-0,2e0d40610309f15c151329ec04ca5b71,LULU,lulu,2025-12-11T21:00:51Z,newsapi,news,,news,"Stock market today: Dow jumps X post to record, S&P 500 climbs above 6,900 for first time",0,,,"The Dow and S&amp;P 500 notched new records on Thursday as US stocks mostly rose, with tech stocks under more pressure after Oracle (ORCL) earnings revived AI overspending worries.
The Dow Jones Ind… [+15789 chars]",https://finance.yahoo.com/news/live/stock-market-today-dow-jumps-650-points-to-post-record-sp-500-climbs-above-6900-for-first-time-210051184.html
429a2585333b04c250b14337c422de55-0,429a2585333b04c250b14337c422de55,LULU,lulu,2025-12-04T03:20:11Z,newsapi,news,,news,Is Lululemon Athletica Stock Underperforming the Nasdaq?,0,,,"Vancouver, Canada-based Lululemon Athletica Inc. (LULU) operates as a lifestyle-inspired athletic apparel company specializing in yoga, running, training, and other active pursuits. With a market cap… [+1827 chars]",https://www.barchart.com/story/news/36445146/is-lululemon-athletica-stock-underperforming-the-nasdaq
e9f1c329a442aa92be4e72d3b0ecac3d-0,e9f1c329a442aa92be4e72d3b0ecac3d,LULU,lulu,2025-12-04T16:43:07Z,newsapi,news,,news,lululemon athletica inc. (LULU): A Bull Case Theory,0,,,"We came across a bullish thesis on lululemon athletica inc. on The Analyst's Journals Substack by A_Capital. In this article, we will summarize the bulls thesis on LULU. lululemon athletica inc.'s sh… [+3556 chars]",https://finance.yahoo.com/news/lululemon-athletica-inc-lulu-bull-164307380.html
e646fe2b6bfe62b8d5048d616853910e-0,e646fe2b6bfe62b8d5048d616853910e,LULU,lulu,2025-12-12T15:00:04Z,newsapi,news,,news,Premarket Movers: Lululemon Soaring on News of CEO Departure,0,,,"lupmotion / Shutterstock.com
<ul><li>Lululemon is up about 9%, or $17 a share on news that CEO Calvin McDonald announced he would leave the company
</li><li>Broadcoms EPS of $1.95 was better than t… [+2686 chars]",https://247wallst.com/investing/2025/12/12/premarket-movers-lululemon-soaring-on-news-of-ceo-departure/
54b083e30f5922139598fa86f5f0e80c-0,54b083e30f5922139598fa86f5f0e80c,LULU,lulu,2025-12-19T17:48:40Z,newsapi,news,,news,This Investor Is Betting $1 Billion on a Lululemon Stock Turnaround. Should You Buy the Dip Here in Hopes of Gains to Come?,0,,,"Activist investing heavyweight Elliott Investment Management just made a bold bet, acquiring a $1 billion stake in Lululemon (LULU). The firm's involvement, coupled with the abrupt departure of CEO C… [+4421 chars]",https://www.barchart.com/story/news/36717956/this-investor-is-betting-1-billion-on-a-lululemon-stock-turnaround-should-you-buy-the-dip-here-in-hopes-of-gains-to-come
c4b4b4ebff7c177a8634af4efd43dc8b-0,c4b4b4ebff7c177a8634af4efd43dc8b,LULU,lulu,2025-12-16T21:30:05Z,newsapi,news,,news,Do You Work Out on Vacation?,0,,,"During the holidays, I could spend all day curled up on the sofa, watching Young Sheldon re-runs with the boys. But, over the years, I’ve found that the secret to enjoying big family gatherings is to… [+3959 chars]",https://cupofjo.com/2025/12/16/do-you-work-out-on-vacation/
9581aeed881e3d6a2e9c4f3d88fb3f37-0,9581aeed881e3d6a2e9c4f3d88fb3f37,LULU,lulu,2025-12-08T16:04:21Z,newsapi,news,,news,"Down 51.9% YTD, Is Lululemon Stock a Buy Ahead of December 11?",0,,,"2025, so far, has been a painful year for shareholders of Lululemon Athletica (LULU). The stock has tumbled 51.9% year-to-date, a steep decline that reflects not only slowing U.S. sales, but also a s… [+4159 chars]",https://www.barchart.com/story/news/36510070/down-51-9-ytd-is-lululemon-stock-a-buy-ahead-of-december-11
61ac1b7fd50b3c254ff5e87c12c8b98f-0,61ac1b7fd50b3c254ff5e87c12c8b98f,LULU,lulu,2025-12-16T06:48:53Z,newsapi,news,,news,27 New ‘Dani & Lulu’ Comics By Mike Swaim,0,,,"Dani and Lulu is the kind of comic that feels chaotic and heartfelt at the same time. Created by Mike Swaim, the series blends spontaneous, offbeat humor with moments of genuine warmth, often coming … [+453 chars]",https://www.boredpanda.com/wholesome-dani-lulu-comics-mike-swaim-part-2/
554670ea195db13e11a96dbb49fc3c26-0,554670ea195db13e11a96dbb49fc3c26,LULU,lulu,2025-12-12T16:16:34Z,newsapi,news,,news,"Stock market today: Dow, S&P 500, Nasdaq sink amid tech exodus on Wall Street",0,,,"Lululemon (LULU) stock popped almost 10% in premarket trading after the Canada-based apparel retailer posted an earnings beat and upbeat full-year profit forecast.
""As we enter the holiday season, w… [+1445 chars]",https://finance.yahoo.com/news/live/stock-market-today-dow-sp-500-nasdaq-sink-amid-tech-exodus-on-wall-street-161634716.html
33e693dc3f240ae86a6759ccb6707f5f-0,33e693dc3f240ae86a6759ccb6707f5f,LULU,lulu,2025-12-11T23:52:26Z,newsapi,news,,news,"Stock market today: Dow eyes fresh record while S&P 500, Nasdaq fall amid exodus from tech",0,,,"Lululemon (LULU) stock popped almost 10% in premarket trading after the Canada-based apparel retailer posted an earnings beat and upbeat full-year profit forecast.
""As we enter the holiday season, w… [+1445 chars]",https://finance.yahoo.com/news/live/stock-market-today-dow-eyes-fresh-record-while-sp-500-nasdaq-fall-amid-exodus-from-tech-235226735.html
43677de76e2f4a467c5a87baf9e14c3c-0,43677de76e2f4a467c5a87baf9e14c3c,LULU,lulu,2025-12-11T23:52:26Z,newsapi,news,,news,"Stock market today: Dow eyes fresh record while S&P 500, Nasdaq futures fall amid exodus from tech",0,,,"Lululemon (LULU) stock popped almost 10% in premarket trading after the Canada-based apparel retailer posted an earnings beat and upbeat full-year profit forecast.
""As we enter the holiday season, w… [+1445 chars]",https://finance.yahoo.com/news/live/stock-market-today-dow-eyes-fresh-record-while-sp-500-nasdaq-futures-fall-amid-exodus-from-tech-235226942.html
23f286dbdde13191ab6df85c0853b389-0,23f286dbdde13191ab6df85c0853b389,LULU,lulu,2025-12-18T11:33:10Z,newsapi,news,,news,"Quirky, Heartfelt, And A Bit Chaotic: 22 Comics From The ‘Dani & Lulu’ Series",0,,,"Dani and Lulu is the kind of comic that feels chaotic and heartfelt at the same time. Created by Mike Swaim, the series blends spontaneous, offbeat humor with moments of genuine warmth, often coming … [+618 chars]",https://www.boredpanda.com/wholesome-dani-lulu-comics-mike-swaim-part-2-msn/
17aba404f8e57ecf75277b6b266ff4db-0,17aba404f8e57ecf75277b6b266ff4db,LULU,lulu,2025-12-11T23:45:29Z,newsapi,news,,news,Lululemon CEO Calvin McDonald to step down amid languishing sales in the US,0,,,"NEW YORK (AP) Lululemon Athletica Inc, (LULU) said Thursday that its CEO Calvin McDonald is stepping down effective Jan. 31 as the athletic wear maker wrestles with a year of disappointing sales.
Th… [+2132 chars]",https://finance.yahoo.com/news/lululemon-ceo-calvin-mcdonald-step-234529728.html
f97a58f95ce7156b53e1fcfb6ea175f1-0,f97a58f95ce7156b53e1fcfb6ea175f1,LULU,lulu,2025-12-18T19:01:56Z,newsapi,news,,news,A Big Activist Investor Is Eyeing Lululemon's Turnaround. Its First Move: Suggesting a CEO,0,,,"Cheng Xin / Getty Images
 Elliott Investment Management has a CEO candidate in mind for Lululemon.
<ul><li>The activist investment group Elliott thinks the former Ralph Lauren CFO Jane Nielsen woul… [+3107 chars]",https://www.investopedia.com/a-big-activist-investor-is-eyeing-lululemon-s-turnaround-its-first-move-suggesting-a-ceo-lulu-11872089
