id,report_id,ticker,company,date,source,doc_type,item,section_type,section_heading,chunk_index,page_start,page_end,text,source_file
901f62935ab1ec782941f34fd56e02c5-0,901f62935ab1ec782941f34fd56e02c5,NKE,nike,2025-12-24T16:41:25Z,newsapi,news,,news,Apple CEO Tim Cook Buys $3 Million of Nike Shares,0,,,"Apple CEO Tim Cook disclosed a roughly $3 million open-market purchase of Nike shares this week (via Reuters).
According to a regulatory filing published yesterday, Cook purchased 50,000 Class B sha… [+1216 chars]",https://www.macrumors.com/2025/12/24/tim-cook-buys-nike-shares/
0730dad345991302372aad0c2bc823b8-0,0730dad345991302372aad0c2bc823b8,NKE,nike,2025-12-10T14:58:59Z,newsapi,news,,news,Meet Gen Z's latest obsession: A sneaker so bouncy it's banned in major races,0,,,"Asics; Hoka; Tyler Le/BI
<ul><li>A Strava report found that Asics Novablasts were more popular than similar Nike or Hoka models.</li><li>Novablasts are very cushioned and bouncy training shoes, whic… [+4726 chars]",https://www.businessinsider.com/gen-z-runners-ditching-nike-hoka-for-asics-2025-12
09dec5d562f4ad698bbddf97d919b036-0,09dec5d562f4ad698bbddf97d919b036,NKE,nike,2025-12-25T10:26:45Z,newsapi,news,,news,Tim Cook just gave Nike a much-needed holiday boost,0,,,"Tim Cook sporting a custom pair of Nike Vomero Plus sneakers at an Apple store reopening in Tokyo earlier this year.Apple
<ul><li>Tim Cook bought $3 million in Nike shares, nearly doubling his stake… [+3001 chars]",https://www.businessinsider.com/nike-tim-cook-3-million-share-purchase-2025-12
f2a7a2077a29657aef0b8ffb860f1c2b-0,f2a7a2077a29657aef0b8ffb860f1c2b,NKE,nike,2025-12-19T15:49:51Z,newsapi,news,,news,Nike is struggling to stay culturally relevant in China,0,,,"Pedestrians walk past a Nike store in China.Cheng Xin/Getty Images
<ul><li>Nike's sales in Greater China fell 17% in its most recent quarter.</li><li>Nike CEO Elliott Hill acknowledged the slump, sa… [+3530 chars]",https://www.businessinsider.com/nike-sales-decline-china-losing-cultural-relevance-2025-12
c85829c8e35c4653935d1b79c15d3785-0,c85829c8e35c4653935d1b79c15d3785,NKE,nike,2025-12-10T15:30:22Z,newsapi,news,,news,WTA signs with Mercedes in 'most significant deal in our history',0,,,"The Women's Tennis Association has announced a long-term partnership with Mercedes-Benz which has the potential to be the largest in women's sport.
The German car manufacturer will become the premie… [+1232 chars]",https://www.bbc.com/sport/tennis/articles/c14vek7e4x7o
c450e06333c89c8a32e885203c04a7ba-0,c450e06333c89c8a32e885203c04a7ba,NKE,nike,2025-12-24T14:55:08Z,newsapi,news,,news,Nike shares are up after Apple CEO Tim Cook buys $3 million in stock,0,,,"Nike shares ticked up 2% in premarket trading on Wednesday after Apple CEO Tim Cook bought nearly $3 million worth of the sportswear makers stock.Cook, who has served on Nikes board since 2005 and is… [+467 chars]","https://www.reutersconnect.com/detail?id=tag:reuters.com,2025:newsml_KBN3NO0MA:2&amp;share=true"
54021dca13b8d2f56371930dfbb38afe-0,54021dca13b8d2f56371930dfbb38afe,NKE,nike,2025-12-18T16:00:01Z,newsapi,news,,news,Nike Hardshell Luggage,0,,,"Upgrade your travel with a luxe four-piece travel set built for style and endurance. This bundle includes a carry-on, check-in suitcase, duffle, and backpack each crafted from durable polycarbonate, … [+383 chars]",https://uncrate.com/nike-hardshell-luggage/
251e0b12ad711140942113487496d38d-0,251e0b12ad711140942113487496d38d,NKE,nike,2025-12-23T14:20:21Z,newsapi,news,,news,LEGO and Nike revive the Air Max 95 Neon for a spring release next year,0,,,"LEGO and Nike make an impactful pairing. We have seen that in the past, and its a story that will repeat itself in the Spring of 2026, when the two stalwarts revive the Nike Air Max 95 in its OG colo… [+2268 chars]",https://www.yankodesign.com/2025/12/23/lego-and-nike-revive-the-air-max-95-neon-for-a-spring-release-next-year/
2f349fabfda04b7cec9d526ab69bc780-0,2f349fabfda04b7cec9d526ab69bc780,NKE,nike,2025-12-04T19:00:01Z,newsapi,news,,news,Nike ACG Zegama Trail Shoe,0,,,"Upgrade your travel with a luxe four-piece travel set built for style and endurance. This bundle includes a carry-on, check-in suitcase, duffle, and backpack each crafted from durable polycarbonate, … [+383 chars]",https://uncrate.com/nike-acg-zegama-trail-shoe/
54dc3b514740c8aaeffc1e129aaaf221-0,54dc3b514740c8aaeffc1e129aaaf221,NKE,nike,2025-12-24T16:25:06Z,newsapi,news,,news,"Tim Cook just bought 50,000 Nike shares, and investors noticed",0,,,"Apple CEO Tim Cook, whos been on Nikes board for 20 years, just doubled his stake in the company. The news helped ease a 13% drop after the companys disappointing quarterly results last week.
If you… [+1683 chars]",https://9to5mac.com/2025/12/24/tim-cook-just-bought-50000-nike-shares-investors-noticed/
1fc5290130dd60aab2a95fdf4aa2b337-0,1fc5290130dd60aab2a95fdf4aa2b337,NKE,nike,2025-12-23T21:00:59Z,newsapi,news,,news,"Today's NYT Connections: Sports Edition Hints and Answers for Dec. 24, #457",0,,,"Looking for the most recent regular Connections answers? Click here for today's Connections hints, as well as our daily answers and hints for The New York Times Mini Crossword, Wordle and Strands puz… [+1934 chars]",https://www.cnet.com/tech/gaming/todays-nyt-connections-sports-edition-hints-and-answers-for-dec-24-457/
7eb205a7ab3a51b419bec6662055b53e-0,7eb205a7ab3a51b419bec6662055b53e,NKE,nike,2025-12-12T19:00:01Z,newsapi,news,,news,Game-Worn & Signed Nike Kobe VI Grinch Sneakers,0,,,"The MeUndies Holiday Collection brings the brand's signature ultra-soft basics into festive territory with seasonal patterns, cozy loungewear, and underwear that straddle comfort and holiday cheer. T… [+330 chars]",https://uncrate.com/game-worn-signed-nike-kobe-vi-grinch-sneakers/
7ac88f377541dfa1a4647f81055416b1-0,7ac88f377541dfa1a4647f81055416b1,NKE,nike,2025-12-05T22:06:20Z,newsapi,news,,news,"NIKE, Inc. (NKE): A Bear Case Theory",0,,,"We came across a bearish thesis on NIKE, Inc. on Uncle Stock Notess Substack. In this article, we will summarize the bulls thesis on NKE. NIKE, Inc.'s share was trading at $65.39 as of December 1st. … [+2419 chars]",https://finance.yahoo.com/news/nike-inc-nke-bear-case-220620409.html
5f74886b8fc2358f37ca97108e413a82-0,5f74886b8fc2358f37ca97108e413a82,NKE,nike,2025-12-01T15:59:47Z,newsapi,news,,news,"Apple says certain iPhone SE, iPad Pro, Apple Watch models now obsolete",0,,,"Apple has updated its list of vintage and obsolete products, with five new additions to the obsolete category including the original iPhone SE, the 12.9-inch iPad Pro (2nd generation), and more. Here… [+1855 chars]",https://9to5mac.com/2025/12/01/apple-says-certain-iphone-se-ipad-pro-apple-watch-models-now-obsolete/
a7ce374106726a6de9f9c6a9e5e2373d-0,a7ce374106726a6de9f9c6a9e5e2373d,NKE,nike,2025-12-15T10:07:20Z,newsapi,news,,news,Nike Men's Court Vision Low Next Nature Shoes $45.75 + Free Shipping,0,,,"This collaborative space allows users to contribute additional information, tips, and insights to enhance the original deal post. Feel free to share your knowledge and help fellow shoppers make infor… [+26 chars]",https://slickdeals.net/f/18969805-nike-men-s-court-vision-low-next-nature-shoes-45-75-free-shipping
993302818f485cd3a6893f4e1f517f9e-0,993302818f485cd3a6893f4e1f517f9e,NKE,nike,2025-12-08T06:22:48Z,newsapi,news,,news,Nike Women's Dunk Low Shoes $62.25 + Free Shpping,0,,,"This collaborative space allows users to contribute additional information, tips, and insights to enhance the original deal post. Feel free to share your knowledge and help fellow shoppers make infor… [+26 chars]",https://slickdeals.net/f/18939652-nike-women-s-dunk-low-shoes-62-25-free-shpping
67af42942c8f6da67ab333b86bfdfd92-0,67af42942c8f6da67ab333b86bfdfd92,NKE,nike,2025-12-12T03:00:56Z,newsapi,news,,news,Nike Air Max Bia Men's Sneakers (Clay Green) $51.75 + Free Shipping,0,,,"This collaborative space allows users to contribute additional information, tips, and insights to enhance the original deal post. Feel free to share your knowledge and help fellow shoppers make infor… [+26 chars]",https://slickdeals.net/f/18955222-nike-air-max-bia-men-s-sneakers-clay-green-51-75-free-shipping
8298c16f954431dcb0da138467024fdd-0,8298c16f954431dcb0da138467024fdd,NKE,nike,2025-12-17T18:47:56Z,newsapi,news,,news,Guggenheim Initiates Nike (NKE) at Buy on Margin Strength,0,,,"NIKE, Inc. (NYSE:NKE) is included among the 12 Best Dogs of the Dow to Invest in.
Guggenheim Initiates Nike (NKE) at Buy on Margin Strength
On December 10, Guggenheim began covering NIKE, Inc. (NYS… [+1999 chars]",https://finance.yahoo.com/news/guggenheim-initiates-nike-nke-buy-184756578.html
7cd991eba9bad7579b584ca9daa2aad3-0,7cd991eba9bad7579b584ca9daa2aad3,NKE,nike,2025-12-25T15:36:47Z,newsapi,news,,news,Nike (NKE) Jumps 4.6% as Tim Cook Hikes Stake,0,,,"We recently published 10 Stocks Lighting Up Market Ahead of Christmas. Nike Inc. (NYSE:NKE) is one of the best performers on Wednesday.
Nike Inc. jumped by 4.64 percent on Wednesday to close at $60 … [+1834 chars]",https://finance.yahoo.com/news/nike-nke-jumps-4-6-153647936.html
dcb4d5983a8dbf7e73adef86ab74dbf5-0,dcb4d5983a8dbf7e73adef86ab74dbf5,NKE,nike,2025-12-06T13:02:00Z,newsapi,news,,news,Nike Made Its Best-Looking Running Shoe,0,,,"The Nike Vomero Plus, in its new sail and baroque brown makeover, is a rare breed of Nike running shoe. Its one of the few Nike runners with no obvious swoosh, Nike having removed its signature logo … [+1951 chars]",https://www.highsnobiety.com/p/nike-vomero-plus-baroque-brown/
a657f28356238da925de4fac77815d63-0,a657f28356238da925de4fac77815d63,NKE,nike,2025-12-10T23:51:34Z,newsapi,news,,news,Think Black Friday Spam Was Out of Control? You Have No Idea,0,,,"During the holidays, you expect a surge of spam emails, especially if you're shopping online. But it may be even worse than you suspected. 
Don't miss any of our unbiased tech content and lab-based … [+3101 chars]",https://www.cnet.com/tech/think-black-friday-spam-was-out-of-control-you-have-no-idea/
81ce604c3dce805ee7c90b8da14de232-0,81ce604c3dce805ee7c90b8da14de232,NKE,nike,2025-12-11T15:00:01Z,newsapi,news,,news,Nike x Kobe Bryant Phantom 6 Elite FG SE Soccer Cleats,0,,,"Happy Head is changing the game in hair care by offering prescription-strength, dermatologist-formulated treatments for hair thinning and loss. Using clinically proven ingredients like Minoxidil, Fin… [+361 chars]",https://uncrate.com/nike-x-kobe-bryant-phantom-6-elite-fg-se-soccer-cleats/
e0e858e1589b1c217a4b91bcb8562812-0,e0e858e1589b1c217a4b91bcb8562812,NKE,nike,2025-12-12T10:01:01Z,newsapi,news,,news,The Grinch is more popular than ever. There's a new McDonald's meal and tons of Christmas merch. Here's why it happened.,0,,,"The Grinch is everywhere: in movies, on store shelves, at McDonald's — and at this NFL game where a fan dressed as the green character.AP Photo/Maria Lysaker
<ul><li>McDonald's ""Grinch Meal"" with pi… [+6586 chars]",https://www.businessinsider.com/grinch-meal-mcdonalds-christmas-movie-show-memes-toys-2025-12
777093cbbccf2c9e9cba482a8cadb43d-0,777093cbbccf2c9e9cba482a8cadb43d,NKE,nike,2025-12-22T17:01:51Z,newsapi,news,,news,Earnings Disappointment Sends Nike Stock Below Key Support. Should You Buy the Dip?,0,,,"Nike (NKE) shares crashed over 10% on Dec. 19 after the footwear giant reported market-beating financials for its Q2 but issued disappointing guidance for the future.
The Beaverton-headquartered fir… [+1896 chars]",https://www.barchart.com/story/news/36746721/earnings-disappointment-sends-nike-stock-below-key-support-should-you-buy-the-dip
1a6d79dd16064e4c5a09623e342bceaf-0,1a6d79dd16064e4c5a09623e342bceaf,NKE,nike,2025-12-02T20:36:01Z,newsapi,news,,news,Nike’s Mocha-Flavored Dunk Is as Tasty as It Is Ornate,0,,,"The Nike Dunk has gone from the basketball court to the skate park, the streets, and beyond. Its next stop? The museum.
Nike has cooked up a new ""Embossed Baroque"" Dunk Low sneaker, which is ultimat… [+1003 chars]",https://www.highsnobiety.com/p/nike-dunk-low-embossed-baroque/
3a64148977b4901066135ea5e02a7592-0,3a64148977b4901066135ea5e02a7592,NKE,nike,2025-12-23T21:21:31Z,newsapi,news,,news,A Super-Thicc Nike Sneaker Born With Aura Points,0,,,"There's a new Nike sneaker in town, and it was born with aura.
In the era of ""aura points"" and ""auramaxxing,"" Nike's brand-new Aura Edge sneaker arrives in perfect time.
It's a sporty sneaker with … [+986 chars]",https://www.highsnobiety.com/p/nike-aura-edge/
d84e689b8f95c845f85b42ede3416c57-0,d84e689b8f95c845f85b42ede3416c57,NKE,nike,2025-12-15T18:19:32Z,newsapi,news,,news,Nike’s Comfiest Air Max Sneaker Goes Fancy Cookies & Cream,0,,,"A classic Nike Air Max 90 sneaker has suddenly returned...and leveled up.
The Air Max 90 ""Coconut Milk/Black"" sneaker is back from 2002, bringing its familiar cookies-and-cream flavor to one of Nike… [+1189 chars]",https://www.highsnobiety.com/p/nike-air-max-90-coconut-milk-black/
7e8e76df9eabd632df3989fdf36f7b65-0,7e8e76df9eabd632df3989fdf36f7b65,NKE,nike,2025-12-07T15:00:02Z,newsapi,news,,news,"As Nike Shakes Up Its C-Suite, Should You Buy, Sell, or Hold NKE Stock?",0,,,"NIKE (NKE), the global icon of sport and streetwear, is hitting the reset button at the very top. With news that the company is dramatically reshuffling its C-suite under CEO Elliott Hills Win Now pl… [+6304 chars]",https://www.barchart.com/story/news/36497105/as-nike-shakes-up-its-c-suite-should-you-buy-sell-or-hold-nke-stock
3401bd7a57d5bc071bb58d83bba0d2b3-0,3401bd7a57d5bc071bb58d83bba0d2b3,NKE,nike,2025-12-23T20:39:33Z,newsapi,news,,news,The Immaculate Nike Air Force 1 Sneaker With Tough (Cordura) Skin,0,,,"At first glance, Nike's latest Air Force 1 Lows look to be another clean addition to the rotation. But there's more to these pairs, actually.
(whispers) They're actually quite tough.
How? Nike has … [+1328 chars]",https://www.highsnobiety.com/p/nike-air-force-1-cordura/
78319aaa148ce60a173acd0f37a9b755-0,78319aaa148ce60a173acd0f37a9b755,NKE,nike,2025-12-08T20:45:48Z,newsapi,news,,news,A Lot of Love Went Into These Utterly Adorable Nike Dunks,0,,,"There's so much love oozing from these adorable and tiny Nike Dunk Lows.
Nike's already getting into the Valentine's Day spirit, prepping a cute Dunk Low sneaker filled with plenty of love.
These p… [+1280 chars]",https://www.highsnobiety.com/p/nike-dunk-low-valentines-day/
62f42c9f4e8b3430628e460cc25824fc-0,62f42c9f4e8b3430628e460cc25824fc,NKE,nike,2025-12-07T17:53:12Z,newsapi,news,,news,Nike’s Blacked-Out Leather Air Maxes Are Criminally Clean,0,,,"Nike's ""Triple Black"" colorway may get a bad rep in the sneaker world. But the all-black color scheme creates some of the cleanest sneakers.
Take Nike's newest Air Max 95, for instance. The pair app… [+1301 chars]",https://www.highsnobiety.com/p/nike-air-max-95-premium-leather-black/
1307f008e7855e8b0912d2dfdcf437c0-0,1307f008e7855e8b0912d2dfdcf437c0,NKE,nike,2025-12-18T02:22:00Z,newsapi,news,,news,The Air Jordan 4 “Black Cat” Is Comfortable in the Dark,0,,,"The Air Jordan 4 Black Cat was never built for spectacle. First released in 2006, the shoe quietly became a favorite among Jordan fans who preferred restraint over noise, a sneaker that didnt need co… [+1654 chars]",https://www.highsnobiety.com/p/nike-air-jordan-4-black-cat-2025/
d86624bf4360b670ac03ecaa4ec4cb5d-0,d86624bf4360b670ac03ecaa4ec4cb5d,NKE,nike,2025-12-20T20:19:24Z,newsapi,news,,news,This Just Might Be Nike's Iciest Jordan 1 Sneaker Yet,0,,,"New year, new...iced-out Jordan 1 sneakers? Precisely.
Nike and Swarovski's gleaming friendship has brought flashy Air Maxes and even high-end basketball shoes previously. Next up, the two minds int… [+1150 chars]",https://www.highsnobiety.com/p/swarovski-jordan-1-sneakers/
47228f1443832bbd9b379b54b4c2015a-0,47228f1443832bbd9b379b54b4c2015a,NKE,nike,2025-12-02T21:38:18Z,newsapi,news,,news,A High-Tech Nike Air Max Made With Lots & Lots of Love,0,,,"A lot of love went into Vaquera's Nike Air Max DN8 sneaker. 
The brand's upcoming collaboration looks like someone took a clean white DN8 and kissed it all over, covering the advanced model in red l… [+1109 chars]",https://www.highsnobiety.com/p/vaquera-nike-air-max-dn8/
52ad7a64ffc9cf289bd5baf43b10da81-0,52ad7a64ffc9cf289bd5baf43b10da81,NKE,nike,2025-12-22T17:21:32Z,newsapi,news,,news,"Nike Made Its Toughest Air Max Boot Into a Lovely ""Cherry Blossom"" Treat",0,,,"Nike's next Air Max Goadome boot is a treat for the DMV.
The latest version of the rugged winter boot arrives with creamy, cherry-flavored leather uppers and a ""DMV"" stamp on the heel, all capped of… [+1703 chars]",https://www.highsnobiety.com/p/nike-air-max-goadome-cherry-blossom/
6a62902d893197abfb9ec15ce42d7802-0,6a62902d893197abfb9ec15ce42d7802,NKE,nike,2025-12-02T11:32:31Z,newsapi,news,,news,"Moving or Not, This Nike Gear Keeps Body Temperature Where It’s Supposed to Be",0,,,"Typically, the necessity to brave the cold weather tends to coincide with the arrival of the holiday season. From beanies to puffers and heavyweight tops, winterwear makes for an excellent and genuin… [+3359 chars]",https://www.highsnobiety.com/p/nike-gift-guide-winter-gear/
dc1090c20b007adda5a51a27d0fc8988-0,dc1090c20b007adda5a51a27d0fc8988,NKE,nike,2025-12-09T23:02:51Z,newsapi,news,,news,"To Make Nike Air Maxes This Good, One Must First Be UNDEFEATED",0,,,"Nike's next pair of Air Max 95s is simply undefeated, designed by UNDEFEATED, of course.
The Los Angeles brand delivers a clean, low-key luxe take on the iconic model, dressing it in classic colorwa… [+1472 chars]",https://www.highsnobiety.com/p/undefeated-nike-air-max-95/
fc2a407ff479d02dd721b65065085dcd-0,fc2a407ff479d02dd721b65065085dcd,NKE,nike,2025-12-05T21:54:44Z,newsapi,news,,news,The Stealthy Nike Dunks Wearing Secretly Great Corduroy Trousers,0,,,"There are regular Nike Dunks, and then there are corduroy Nike Dunks. Both are good, but the latter is just slightly better.
Various black ribbed textures cover the latest Dunk Low sneakers, creatin… [+911 chars]",https://www.highsnobiety.com/p/nike-dunk-low-black-corduroy/
9c7dd76671caccde0bca93b6c035f331-0,9c7dd76671caccde0bca93b6c035f331,NKE,nike,2025-12-06T20:56:44Z,newsapi,news,,news,A Gorgeous Green Nike Air Force 1 Straight from the NYC Streets,0,,,"LAAMS' Nike Air Force 1 Low sneakers are inspired by the streets of New York City. Now, the collab is ready to hit the streets. 
Specifically, the collaborative green pairs draw inspiration from tho… [+1720 chars]",https://www.highsnobiety.com/p/laams-nike-air-force-1/
0743dd92a7c5c91a1b1fc9b819b258f9-0,0743dd92a7c5c91a1b1fc9b819b258f9,NKE,nike,2025-12-02T18:26:41Z,newsapi,news,,news,Nike’s Luxe Leather Dunks Come Dressed for the Occasion,0,,,"Nike Dunks with the dress shoe treatment? You know what, sure.
We're already in the midst of a dressy sneaker takeover. Why not add a formalized Dunk to the mix? Nike makes it so.
For the latest dr… [+1188 chars]",https://www.highsnobiety.com/p/nike-dunk-low-dress-shoe-black/
81d71569b81991eff8cdf8d37d88c9ea-0,81d71569b81991eff8cdf8d37d88c9ea,NKE,nike,2025-12-15T17:19:46Z,newsapi,news,,news,Nike’s Most Advanced Air Max Sneaker Is Extra Powerful in All-Black Leather,0,,,"It's been less than a year since the Air Max Dn8 debuted, but the sneaker has already enjoyed a handful of impressive colorways and designs. Next up, Nike gives the high-tech model its cleanest makeo… [+1368 chars]",https://www.highsnobiety.com/p/nike-air-max-dn8-black-leather/
d2cc28c4b36b2d517b281837b16f870b-0,d2cc28c4b36b2d517b281837b16f870b,NKE,nike,2025-12-20T17:22:34Z,newsapi,news,,news,Nike’s 30-Year-Old Air Max Sneaker Goes LEGO,0,,,"For its next trick, Nike will build an Air Max 95 sneaker out of LEGOs.
Not actually. But the next Air Max 95 sneaker was made in collaboration with the brick toy company.
LEGO's Nike Air Max 95 sn… [+1427 chars]",https://www.highsnobiety.com/p/lego-nike-air-max-95/
cb2fa9272ab69fd98d3cedbe74b4eaef-0,cb2fa9272ab69fd98d3cedbe74b4eaef,NKE,nike,2025-12-17T15:00:08Z,newsapi,news,,news,These faces and apps support 1Hz display on Apple Watch Ultra 3 and Series 11,0,,,"Apple Watch Ultra 3 and Series 11 feature advanced, power-efficient LTPO3 displays that enhance certain watch faces and apps. This technology enables a 1Hz display refresh rate, allowing the display … [+1258 chars]",https://9to5mac.com/2025/12/17/these-faces-and-apps-support-1hz-display-on-apple-watch-ultra-3-and-series-11/
e109e34636f267f0d2c4ac7dd08bfc9b-0,e109e34636f267f0d2c4ac7dd08bfc9b,NKE,nike,2025-12-21T21:39:56Z,newsapi,news,,news,"With Cordura, Nike's Rugged ""Dunk"" Is Nearly Unstoppable",0,,,"Nike just made its rugged C1TY sneaker even more, well, rugged.
The latest ""Light Khaki"" pairs arrive with the standard outdoor-ready touches, such as sturdy lug-rubber soles, hiking-style laces, an… [+1046 chars]",https://www.highsnobiety.com/p/nike-c1ty-cordura-light-khaki/
32427f88f5ce7d49d327a430c3c82d27-0,32427f88f5ce7d49d327a430c3c82d27,NKE,nike,2025-12-21T21:01:33Z,newsapi,news,,news,The Super-Advanced Nike Sneaker Born To Be a Street Flex,0,,,"The Nike Ava Rover is built like one of the brand's most advanced running shoes (and it looks like one, too). But Nike makes it clear that its newest sneaker is also very much street-ready.
Its colo… [+1100 chars]",https://www.highsnobiety.com/p/nike-ava-rover-iron-grey/
20e8115dd51480c4bb304f2fc23da498-0,20e8115dd51480c4bb304f2fc23da498,NKE,nike,2025-12-21T18:18:42Z,newsapi,news,,news,Nike’s Quietly Stylish Skate Shoe Is Officially Ice-Cold,0,,,"Nyah Huston's Nike SB signature shoe has gone ice man.
The Nike SB Zoom Nyjah 4 sneaker appears in an icy ""Glacier Blue"" colorway, giving the sleek skate shoe a nice ""frosted"" look.
Underneath the … [+1013 chars]",https://www.highsnobiety.com/p/nike-sb-zoom-nyjah-4-glacier-blue/
2ac48e948cd309832a4b9fbcebbdd376-0,2ac48e948cd309832a4b9fbcebbdd376,NKE,nike,2025-12-27T22:22:00Z,newsapi,news,,news,Nike’s Best Running Sneaker Looks Like a Sexy Lava Lamp,0,,,"It's not easy to make a sneaker that's both decidedly dense and considerably chic. But naturally, Nike makes it look like light work. 
The Nike Vomero Plus shoe is already one of the Swoosh's finest… [+1568 chars]",https://www.highsnobiety.com/p/nike-vomero-sneaker-black-silver/
416998fcb5d7dffdb8c625dddf8a8f56-0,416998fcb5d7dffdb8c625dddf8a8f56,NKE,nike,2025-12-11T00:00:00Z,newsapi,news,,news,What Would My Life At Camp Half-Blood Be Like Quiz,0,,,"Percy Jackson and the Olympians follows the story of Percy, a child who discovers that he is a demigod (a child with one human parent and one Greek god parent). In the first book of the series, The L… [+985 chars]",https://www.wikihow.com/Percy-Jackson-Quiz
3d765c3f490dff2b19a5cd3b25721d38-0,3d765c3f490dff2b19a5cd3b25721d38,NKE,nike,2025-12-01T18:04:53Z,newsapi,news,,news,Nike’s Most Stylish Running Shoe Gets to Sit at the “Cool” Kids Table,0,,,"Nike's Pegasus Premium is already one of the most stylish running shoes on the market. Now, it's official ""cool,"" thanks to its latest colorway.
With the newest pair, Nike blends ""Wolf Grey"" with cl… [+1173 chars]",https://www.highsnobiety.com/p/nike-pegasus-premium-cool-grey/
e4a58d0d4aa2c201d84ab4e8d4a1b001-0,e4a58d0d4aa2c201d84ab4e8d4a1b001,NKE,nike,2025-12-11T19:19:47Z,newsapi,news,,news,Nike is Guarding the Culture On and Off the Field,0,,,"In football, no position is more visually or symbolically distinct than the goalkeeper. They dress differently, stand apart from the crowd, and take responsibility for the moment when everything is o… [+3641 chars]",https://www.highsnobiety.com/p/nike-hollywood-goalkeepers-collection/
d9f50f10c7ebc5c2c126b8cd03b5ff0b-0,d9f50f10c7ebc5c2c126b8cd03b5ff0b,NKE,nike,2025-12-08T21:41:09Z,newsapi,news,,news,What The! Nike’s Last Book 1 Is an Insane Mashup of Its Best,0,,,"As Nike and Devin Booker prepare for the Book 2's debut, the pairing is closing out the Book 1 chapter with a bang. Really, it's more like a ""what the.""
That's right. Nike's next (and final?) Book 1… [+1514 chars]",https://www.highsnobiety.com/p/nike-book-1-what-the/
e14bbd137075d159da207990cb1e1e44-0,e14bbd137075d159da207990cb1e1e44,NKE,nike,2025-12-03T18:06:54Z,newsapi,news,,news,"Nike Rebuilt Its Pegasus Shoe for Mud, Rain, Winter & Everything Else",0,,,Nike quietly turned the Pegasus into a waterproof trail shoe built for winter miles and wet concrete. The Pegasus Trail 5 GORE-TEX sneaker takes the long-running workhorse and outfits it for cold rai… [+1914 chars],https://www.highsnobiety.com/p/nike-pegasus-trail-5-gore-tex-black-phantom-tattoo-volt-ice/
2f07daf113a541e3e01d83ddf96ef41c-0,2f07daf113a541e3e01d83ddf96ef41c,NKE,nike,2025-12-03T23:33:00Z,newsapi,news,,news,Nike's Rugged Air Max Work Boot Is Suddenly Looking Cow-tastic,0,,,"Nikes Air Max Goadome Sail Black Cocoa boot will have you moo-ving different from previous versions of one of the brands toughest silhouettes, turning it into something plush and surprisingly luxurio… [+1617 chars]",https://www.highsnobiety.com/p/nike-cowhide-air-max-winter-boot/
ea81ebb820b581458f00007c1db5b6be-0,ea81ebb820b581458f00007c1db5b6be,NKE,nike,2025-12-05T20:38:50Z,newsapi,news,,news,"Nike's ""Chanel"" Air Force 1s Are Equally Rugged & Cutesy",0,,,"Nike's got its own ""Chanel"" Air Force 1 Lows.
The new sneakers aren't an official Chanel x Nike collaboration, by the way. They're actually called the ""Boucle"" Forces, which are basically these gree… [+1386 chars]",https://www.highsnobiety.com/p/nike-air-force-1-boucle/
