id,report_id,ticker,company,date,source,doc_type,item,section_type,section_heading,chunk_index,page_start,page_end,text,source_file
Aritzia-Inc-Q3-2025-MDA-26,Aritzia-Inc-Q3-2025-MDA,ATZ,,,mda_canada,md&a,,md&a,,26,17,17,"The increase was primarily driven by a positive response to the Company's Fall and Winter product as well as the Company's investment in digital marketing which fueled strong traffic growth, particularly in the United States . The following table provides net revenue by channel and geographic location for the periods indicated. (unaudited, in thousands of Canadian dollars) Q3 2025 Q3 2024 Retail net revenue $ 486,559 $ 441,056 eCommerce net revenue 242,142 212,468 Net revenue $ 728,701 $ 653,524 Q3 2025 Q3 2024 United States net revenue $ 403,720 $ 326,605 Canada net revenue 324,981 326,919 Net revenue $ 728,701 $ 653,524 Gross profit increased 23.1% to $333.5 million, compared to $270.9 million in Q3 2024. Gross profit margin1 was 45.8%, compared to 41.5% in Q3 2024. The increase in gross profit margin of approximately 430 bps was primarily driven by IMU improvements, lower markdowns, lower warehousing costs and savings from the Company's smart spending initiative, partially offset by higher freight costs. SG&A expenses increased 15.1% to $215.6 million, compared to $187.4 million in Q3 2024. SG&A expenses were 29.6% of net revenue, compared to 28.7% in Q3 2024. The increase in SG&A expenses was primarily driven by variable selling costs associated with the increase in net revenue, as well as investments in digital marketing, flagship locations, infrastructure projects and technology initiatives. Depreciation and amortization increased $4.4 million to $46.7 million, compared to $42.4 million in Q3 2024 primarily due to the increase in leased assets and new and repositioned boutique openings. The following table provides the depreciation and amortization expense for the periods indicated.",nlp\raw_data\sec_can\atz_q_mda\Aritzia-Inc-Q3-2025-MDA.pdf
Aritzia-Inc-Q3-2025-MDA-27,Aritzia-Inc-Q3-2025-MDA,ATZ,,,mda_canada,md&a,,md&a,,27,17,18,"(unaudited, in thousands of Canadian dollars) Q3 2025 Q3 2024 Depreciation on right-of-use assets $ 26,459 $ 25,524 Depreciation and amortization 20,275 16,847 Total depreciation and amortization $ 46,734 $ 42,371 Stock-based compensation expense was $10.2 million, compared to $9.4 million in Q3 2024. The following table provides details of the stock-based compensation expense for the periods indicated. (unaudited, in thousands of Canadian dollars) Q3 2025 Q3 2024 Equity-settled plans Stock options $ 5,167 $ 5,457 Restricted Share Units 2,749 1,767 Performance Share Units 1,587 1,354 Cash-settled plans Restricted Share Units 239 628 Deferred Share Units 502 243 Stock-based compensation expense $ 10,244 $ 9,449 The Company uses equity derivative contracts to offset our cash flow variability of the expected payment associated with our cash-settled deferred and restricted share units. Realized and unrealized gains and losses related to these equity derivative contracts are recorded in other income. Finance expense decreased $0.9 million to $12.8 million, compared to $13.6 million in Q3 2024. The decrease in finance expense was primarily due to a decrease in interest expense on the revolving credit facility partially offset by higher interest expense on lease liabilities in Q3 2025. Other income was $(9.9) million, compared to $(1.7) million in Q3 2024. The following table provides details of other income for the periods indicated.",nlp\raw_data\sec_can\atz_q_mda\Aritzia-Inc-Q3-2025-MDA.pdf
Aritzia-Inc-Q3-2025-MDA-28,Aritzia-Inc-Q3-2025-MDA,ATZ,,,mda_canada,md&a,,md&a,,28,18,18,"(unaudited, in thousands of Canadian dollars) Q3 2025 Q3 2024 Realized foreign exchange loss (gain) $ 536 $ (3,993) Unrealized foreign exchange (gain) loss (9,290) 2,562 Unrealized (gain) loss on equity derivative contracts (292) 390 CYC related costs and other expenses (134) 102 Interest and other income (738) (787) Other income $ (9,918) $ (1,726) Income tax expense is recognized based on management’s best estimate of the weighted average annual income tax rate expected for the full fiscal year. To the extent that forecasts differ from actual results, adjustments are recognized in subsequent periods. The statutory income tax rate for Q3 2025 and Q3 2024 was 26.8% and 26.7%, respectively. Income tax expense was $30.7 million, compared to $19.1 million in Q3 2024 and the effective tax rate for Q3 2025 and Q3 2024 were 29.3% and 30.7%, respectively. The effective tax rates are driven largely by the proportionate amount of non-deductible stock-based compensation expense on equity settled plans relative to net income before income taxes. Net income was $74.1 million, an increase of 71.9% compared to $43.1 million in Q3 2024. Net income per diluted share was $0.63 per share, an increase of 65.8% compared to $0.38 per share in Q3 2024. The increase in net income and net income per diluted share was primarily attributable to the factors discussed above. Adjusted EBITDA1 was $136.4 million, or 18.7% of net revenue1, an increase of 48.7% compared to $91.8 million, or 14.0% of net revenue in Q3 2024. The increase in Adjusted EBITDA and Adjusted EBITDA as a percentage of net revenue was attributable to the factors discussed above.",nlp\raw_data\sec_can\atz_q_mda\Aritzia-Inc-Q3-2025-MDA.pdf
Aritzia-Inc-Q3-2025-MDA-29,Aritzia-Inc-Q3-2025-MDA,ATZ,,,mda_canada,md&a,,md&a,,29,18,18,"Adjusted Net Income1 was $83.0 million, an increase of 57.5% compared to $52.7 million in Q3 2024. Adjusted Net Income per Diluted Share1 was $0.71 per share, an increase of 51.1% compared to $0.47 per share in Q3 2024. The increase in Adjusted Net Income and Adjusted Net Income per Diluted Share was primarily attributable to the factors discussed above. Cash and cash equivalents at the end of Q3 2025 totaled $207.0 million compared to $140.8 million at the end of Q3 2024. See ""Analysis of Cash Flows for the Third Quarter Fiscal 2025"" and ""Analysis of Cash Flows for YTD 2025"" for further details. Inventory at the end of Q3 2025 was $462.0 million, an increase of 16.4% compared to $397.0 million at the end of Q3 2024. Capital cash expenditures (net of proceeds from lease incentives)1 were $81.9 million in Q3 2025, compared to $41.4 million in Q3 2024. The increase in capital cash expenditures is primarily due to capital investments in new and repositioned boutiques.",nlp\raw_data\sec_can\atz_q_mda\Aritzia-Inc-Q3-2025-MDA.pdf
Aritzia-Inc-Q3-2025-MDA-30,Aritzia-Inc-Q3-2025-MDA,ATZ,,,mda_canada,md&a,,md&a,,30,19,19,"analysis of results for ytd 2025 consolidated statements of operations ( unaudited, in thousands of canadian dollars, unless otherwise noted ) ytd 2025 ytd 2024 % of net % of net revenue revenue net revenue $ 1, 842, 994 100. 0 % $ 1, 650, 380 100. 0 % cost of goods sold 1, 042, 479 56. 6 % 1, 012, 646 61. 4 % gross profit 800, 515 43. 4 % 637, 734 38. 6 % selling, general and administrative 591, 441 32. 1 % 511, 948 31. 0 % stock - based compensation expense 30, 997 1. 7 % 16, 428 1. 0 % income from operations 178, 077 9. 7 % 109, 358 6. 6 % finance expense 38, 173 2. 1 % 36, 662 2. 2 % other income ( 15, 409 ) ( 0. 8 ) % ( 4, 809 ) ( 0. 3 ) % income before income taxes 155, 313 8. 4 % 77, 505 4. 7 % income tax expense 47, 165 2. 6 % 22, 932 1. 4 % net income $ 108, 148 5. 9 % $ 54, 573 3. 3 % net income per diluted share $ 0. 93 $ 0. 48 adjusted ebitda1 $ 245, 472 13. 3 % $ 144, 511 8. 8 % adjusted net income1 $ 132, 524 7. 2 % $ 67, 334 4. 1 % adjusted net income per diluted share1 $ 1. 14 $ 0. 59 net revenue increased 11. 7 % to $ 1. 8 billion, compared to $ 1. 7 billion in ytd 2024. Comparable sales2 growth was 5.3%. Results continue to be driven by performance in the United States, where net revenue increased 20.6% to $1.0 billion, compared to $857.4 million in YTD 2024.",nlp\raw_data\sec_can\atz_q_mda\Aritzia-Inc-Q3-2025-MDA.pdf
Aritzia-Inc-Q3-2025-MDA-31,Aritzia-Inc-Q3-2025-MDA,ATZ,,,mda_canada,md&a,,md&a,,31,19,20,"Net revenue in Canada increased 2.0% to $809.2 million, compared to $793.0 million in YTD 2024. – Retail net revenue increased 12.3% to $1.3 billion, compared to $1.1 billion in YTD 2024. The increase in net revenue was primarily driven by strong performance of the Company's new and repositioned boutiques, as well as positive comparable sales growth in its existing boutiques. – eCommerce net revenue increased 10.2% to $573.0 million, compared to $519.7 million in YTD 2024. The increase was primarily driven by inventory optimization and traffic growth in the United States, fueled by the Company's investments in digital marketing. The following table provides net revenue by channel and geographic location for the periods indicated. (unaudited, in thousands of Canadian dollars) YTD 2025 YTD 2024 Retail net revenue $ 1,270,023 $ 1,130,640 eCommerce net revenue 572,971 519,740 Net revenue $ 1,842,994 $ 1,650,380 YTD 2025 YTD 2024 United States net revenue $ 1,033,776 $ 857,355 Canada net revenue 809,218 793,025 Net revenue $ 1,842,994 $ 1,650,380 Gross profit increased 25.5% to $800.5 million, compared to $637.7 million in YTD 2024. Gross profit margin1 was 43.4%, compared to 38.6% in YTD 2024. The increase in gross profit margin of approximately 480 bps was primarily driven by lower markdowns, IMU improvements and lower warehousing costs and savings from the Company's smart spending initiative, partially offset by higher freight costs. SG&A expenses increased 15.5% to $591.4 million, compared to $511.9 million in YTD 2024.",nlp\raw_data\sec_can\atz_q_mda\Aritzia-Inc-Q3-2025-MDA.pdf
Aritzia-Inc-Q3-2025-MDA-32,Aritzia-Inc-Q3-2025-MDA,ATZ,,,mda_canada,md&a,,md&a,,32,20,20,"SG&A expenses were 32.1% of net revenue, compared to 31.0% in YTD 2024. The increase in SG&A expenses was primarily driven by investments in digital marketing to protect and propel the Aritzia brand, as well as investments in infrastructure projects and technology initiatives to support the Company's growth. Depreciation and amortization increased $17.0 million to $138.7 million, compared to $121.7 million in YTD 2024 primarily due to the increase in leased assets, new and repositioned boutique openings, and the opening of our Vaughan, Ontario distribution centre part-way through Q2 2024. The following table provides the depreciation and amortization expense for the periods indicated. (unaudited, in thousands of Canadian dollars) YTD 2025 YTD 2024 Depreciation on right-of-use assets $ 79,690 $ 75,358 Depreciation and amortization 59,052 46,352 Total depreciation and amortization $ 138,742 $ 121,710 Stock-based compensation expense was $31.0 million, compared to $16.4 million in YTD 2024. The increase in stock-based compensation expense was primarily due to the effect of share price changes (i.e., mark-to-market) on our cash-settled restricted and deferred share units. The following table provides details of the stock-based compensation expense for the periods indicated. (unaudited, in thousands of Canadian dollars) YTD 2025 YTD 2024 Equity-settled plans Stock options $ 15,002 $ 13,870 Restricted Share Units 6,512 4,235 Performance Share Units 3,258 3,632 Cash-settled plans Restricted Share Units 2,351 (2,978) Deferred Share Units 3,874 (2,331) Stock-based compensation expense $ 30,997 $ 16,428 The Company uses equity derivative contracts to offset our cash flow variability of the expected payment associated with our cash-settled deferred and restricted share units.",nlp\raw_data\sec_can\atz_q_mda\Aritzia-Inc-Q3-2025-MDA.pdf
Aritzia-Inc-Q3-2025-MDA-33,Aritzia-Inc-Q3-2025-MDA,ATZ,,,mda_canada,md&a,,md&a,,33,20,21,"Unrealized gains and losses related to these equity derivative contracts are recorded in other income. Finance expense increased $1.5 million to $38.2 million, compared to $36.7 million in YTD 2024. The increase in finance expense was primarily due to higher interest expense on lease liabilities partially offset by a decrease in interest expense on the revolving credit facility. Other income was $(15.4) million, compared to $(4.8) million in YTD 2024. The following table provides details of other income for the periods indicated. (in thousands of Canadian dollars) YTD 2025 YTD 2024 Realized foreign exchange (gain) $ (1,763) $ (1,712) Unrealized foreign exchange (gain) loss (6,177) 394 Fair value adjustment of NCI in exchangeable shares liability — (15,000) Unrealized (gain) loss on equity derivative contracts (6,129) 11,623 CYC related costs and expenses 2,487 1,853 Interest and other income (3,827) (1,967) Other income $ (15,409) $ (4,809) As a result of the Company's early acquisition of the remaining 25% CYC ownership interest on May 26, 2023, the Company revalued the non-controlling interest in exchangeable shares liability to $20.5 million as at May 26, 2023 based on a Monte Carlo simulation which resulted in a $15.0 million gain recorded in other income. See note 12 of the Fiscal 2024 audited consolidated financial statements for further details. Income tax expense is recognized based on management’s best estimate of the weighted average annual income tax rate expected for the full fiscal year. To the extent that forecasts differ from actual results, adjustments are recognized in subsequent periods. The statutory income tax rates for YTD 2025 and YTD 2024 were 26.8% and 26.7%, respectively.",nlp\raw_data\sec_can\atz_q_mda\Aritzia-Inc-Q3-2025-MDA.pdf
Aritzia-Inc-Q3-2025-MDA-34,Aritzia-Inc-Q3-2025-MDA,ATZ,,,mda_canada,md&a,,md&a,,34,21,21,"Income tax expense was $47.2 million, compared to $22.9 million in YTD 2024 and the effective tax rates for YTD 2025 and YTD 2024 were 30.4% and 29.6%, respectively. The effective tax rates are driven largely by the proportionate amount of non-deductible stock-based compensation expense on equity settled plans relative to net income before income taxes and, in YTD 2024, the non-deductible fair value adjustment of non-controlling interest in exchangeable shares liability. Net income was $108.1 million, an increase of 98.2% compared to $54.6 million in YTD 2024. Net income per diluted share was $0.93, an increase of 93.8%, compared to $0.48 in YTD 2024. The increase in net income and net income per diluted share was primarily attributable to the factors discussed above. Adjusted EBITDA1 was $245.5 million, or 13.3% of net revenue1, an increase of 69.9%, compared to $144.5 million, or 8.8% of net revenue in YTD 2024. The increase in Adjusted EBITDA and Adjusted EBITDA as a percentage of net revenue was primarily attributable to the factors discussed above. Adjusted Net Income1 was $132.5 million, an increase of 96.8%, compared to $67.3 million in YTD 2024. Adjusted Net Income per Diluted Share1 was $1.14, an increase of 93.2%, compared to $0.59 in YTD 2024. The increase in Adjusted Net Income and Adjusted Net Income per Diluted Share was primarily attributable to the factors discussed above. Capital cash expenditures (net of proceeds from lease incentives)1 were $187.2 million, compared to $113.6 million in YTD 2024. The increase in capital cash expenditures is primarily due to capital investments in new and repositioned boutiques.",nlp\raw_data\sec_can\atz_q_mda\Aritzia-Inc-Q3-2025-MDA.pdf
Aritzia-Inc-Q3-2025-MDA-35,Aritzia-Inc-Q3-2025-MDA,ATZ,,,mda_canada,md&a,,md&a,,35,21,22,"LIQUIDITY AND CAPITAL RESOURCES Overview Our principal uses of funds are for operating expenses, capital expenditures and debt service requirements. We believe that cash generated from operations, together with amounts available under our revolving credit facility and revolving line of credit, are expected to be sufficient to meet our future operating expenses, capital expenditures, debt service requirements and return to shareholders (share buybacks). Our ability to fund future operating expenses, capital expenditures, debt service requirements and return to shareholders (share buybacks) will depend on, among other things, our future operating performance, which will be affected by general economic, financial and other factors, including factors beyond our control. See “Summary of Factors Affecting Performance”, “Recent Events” and “Risk Factors” of this MD&A for additional information. We review investment opportunities in the normal course of our business and may make select investments to implement our business strategy when suitable opportunities arise. Historically, the funding for any such investments has come from cash flows from operating activities and/or our revolving credit facility and revolving line of credit. Revolving Credit Facility and Revolving Line of Credit As at December 1, 2024, we have a $300.0 million revolving credit facility and a US$10.0 million revolving line of credit issued by a member of the lending syndicate in connection with the revolving credit facility. The revolving credit facility bears interest at banker's acceptance rate (""BA""), Secured Overnight Financing Rate (""SOFR"") (prior to June 30, 2023, London Inter-Bank Offered Rate (""LIBO"")) or Canadian prime rate, plus a marginal rate between 0.75% and 2.75% (March 3, 2024 – 0.75% and 2.75%). The revolving line of credit bears interest at the daily SOFR, plus a marginal rate between 1.75% and 2.75% (March 3, 2024 – 1.75% and 2.75%). No amounts were drawn on the revolving credit facility nor the revolving line of credit as at December 1, 2024.",nlp\raw_data\sec_can\atz_q_mda\Aritzia-Inc-Q3-2025-MDA.pdf
Aritzia-Inc-Q3-2025-MDA-36,Aritzia-Inc-Q3-2025-MDA,ATZ,,,mda_canada,md&a,,md&a,,36,22,22,"The revolving credit facility agreement (including the revolving line of credit by extension) contains restrictive covenants customary for credit facilities of this nature, including restrictions on us and each credit facility guarantor, subject to certain exceptions, to incur indebtedness, grant liens, merge, amalgamate or consolidate with other companies, transfer, lease or otherwise dispose of all or substantially all of its assets, liquidate or dissolve, engage in any material business other than the fashion retail business, make investments, acquisitions, loans, advances or guarantees, make any restricted payments, enter into transactions with affiliates, repay indebtedness, enter into restrictive agreements, enter into sale-leaseback transactions, ensure pension plan compliance, sell or discount receivables, enter into agreements with unconditional purchase obligations, issue shares, create or acquire a subsidiary or make any hostile acquisitions. In addition, as at December 1, 2024, we also have letters of credit facilities of CAD$30.0 million and US$25.0 million (March 3, 2024 - CAD$50.0 million and US$40.0 million), secured pari passu with the revolving credit facility and the revolving line of credit. The interest rate for the letters of credit is between 1.17% and 2.75%. See “Off-Balance Sheet Arrangements” for details regarding the letters of credit issued. Cash Flows The following table presents cash flows for the periods indicated.",nlp\raw_data\sec_can\atz_q_mda\Aritzia-Inc-Q3-2025-MDA.pdf
Aritzia-Inc-Q3-2025-MDA-37,Aritzia-Inc-Q3-2025-MDA,ATZ,,,mda_canada,md&a,,md&a,,37,22,22,"(unaudited, in thousands of Canadian dollars) Q3 2025 Q3 2024 YTD 2025 YTD 2024 Net cash generated from operating activities $ 214,867 $ 241,079 $ 297,161 $ 259,135 Net cash used in financing activities (28,170) (130,971) (56,731) (68,901) Cash used in investing activities (85,507) (45,344) (197,584) (135,728) Effect of exchange rate changes on cash and cash equivalents 1,834 (476) 884 (212) Change in cash and cash equivalents $ 103,024 $ 64,288 $ 43,730 $ 54,294 Analysis of Cash Flows for the Third Quarter Fiscal 2025 Net Cash Generated From Operating Activities For Q3 2025, net cash generated from operating activities totaled $214.9 million, compared to $241.1 million in Q3 2024. This change was primarily attributable to an increase in the use of working capital primarily due to the timing of inventory purchases and payments, and an increase in interest and income taxes paid, partially offset by an increase in income from operations and deferred revenue. Net Cash Used In Financing Activities For Q3 2025, net cash used in financing activities totaled $28.2 million, compared to $131.0 million in Q3 2024. Financing activities in Q3 2025 primarily relate to the repayment of principal on lease liabilities and the repurchase of subordinate voting shares under the Company's NCIB for cancellation, partially offset by proceeds received from lease incentives and proceeds received from options exercised. Financing activities in Q3 2024 primarily relate to the repayment of the $100 million draw on the revolving credit facility, the repayment of principal on lease liabilities and the repurchase of subordinate voting shares under the Company's NCIB for cancellation, partially offset by proceeds from lease incentives and proceeds received from options exercised.",nlp\raw_data\sec_can\atz_q_mda\Aritzia-Inc-Q3-2025-MDA.pdf
Aritzia-Inc-Q3-2025-MDA-38,Aritzia-Inc-Q3-2025-MDA,ATZ,,,mda_canada,md&a,,md&a,,38,23,23,"Cash Used In Investing Activities For Q3 2025, cash used in investing activities totaled $85.5 million, compared to $45.3 million in Q3 2024. Investing activities in Q3 2025 primarily relate to capital investments in new and repositioned boutiques (including flagship boutiques). In Q3 2024, investing activities primarily relate to capital investments in new and repositioned boutiques, distribution centres, support office expansion and technology infrastructure. Analysis of Cash Flows for YTD 2025 Cash Flows Generated From Operating Activities For YTD 2025, net cash generated from operating activities totaled $297.2 million, compared to $259.1 million in YTD 2024. This change was primarily attributable to the increase in income from operations, timing of payments and increase in deferred revenue, partially offset by the timing of inventory purchases and an increase in interest paid on lease liabilities. Cash Flows Used In Financing Activities For YTD 2025, net cash used in financing activities totaled $56.7 million, compared to $68.9 million in YTD 2024. Financing activities in YTD 2025 primarily relate to the repayment of principal on lease liabilities and the repurchase of subordinate voting shares under the Company's NCIB for cancellation, partially offset by proceeds received from lease incentives and proceeds received from options exercised. Financing activities in YTD 2024 primarily relate to the repayment of principal on lease liabilities and the repurchase of subordinate voting shares under the Company's NCIB for cancellation, partially offset by proceeds received from lease incentives and proceeds received from options exercised. Cash Flows Used In Investing Activities For YTD 2025, cash used in investing activities totaled $197.6 million, compared to $135.7 million in YTD 2024. Investing activities in YTD 2025 primarily relate to capital investments in new and repositioned boutiques (including flagship boutiques).",nlp\raw_data\sec_can\atz_q_mda\Aritzia-Inc-Q3-2025-MDA.pdf
Aritzia-Inc-Q3-2025-MDA-39,Aritzia-Inc-Q3-2025-MDA,ATZ,,,mda_canada,md&a,,md&a,,39,23,24,"Investing activities in YTD 2024 primarily relate to new and repositioned boutiques, distribution center projects, support office expansion and technology infrastructure, as well as a $6.3 million contingent consideration payout to CYC's shareholders. CONTRACTUAL OBLIGATIONS AND COMMITMENTS The following table summarizes our significant undiscounted maturities of our contractual obligations and commitments as at December 1, 2024. Less than 1 More than 5 1 to 5 years Total (unaudited, in thousands of Canadian dollars) year years Accounts payable and accrued liabilities $ 354,331 $ — $ — $ 354,331 Lease liabilities 137,796 537,958 483,884 1,159,638 Minimum lease commitments with future commencement dates 3,982 53,778 77,961 135,721 Total contractual obligations and commitments $ 496,109 $ 591,736 $ 561,845 $ 1,649,690 As at December 1, 2024, the Company also had approximately $103.7 million remaining on issued purchase orders for expected future capital expenditures. Capital expenditures are generally funded from the Company's operating cash flows and, if needed, from the available revolving credit facility. OFF-BALANCE SHEET ARRANGEMENTS Our third party manufacturers purchase raw materials on our behalf to be used for future production. As at December 1, 2024, we had purchase obligations of $84.7 million, which represent commitments for fabric expected to be used during upcoming seasons, made in the normal course of business. We enter into trade letters of credit to facilitate the international purchase of inventory. We also enter into standby letters of credit to secure certain of our obligations, including leases and duties related to import purchases. As at December 1, 2024, letters of credit totaling $8.0 million have been issued. FINANCIAL INSTRUMENTS Financial instruments related to the acquisition of CYC In connection with the acquisition of CYC in June, 2021, we entered into two financial instruments that were revalued on a recurring basis in the consolidated financial statements: contingent consideration and non-controlling interest in exchangeable shares liability.",nlp\raw_data\sec_can\atz_q_mda\Aritzia-Inc-Q3-2025-MDA.pdf
