id,report_id,ticker,company,date,source,doc_type,item,section_type,section_heading,chunk_index,page_start,page_end,text,source_file
Aritzia-Inc-Q2-2026-MDA-18,Aritzia-Inc-Q2-2026-MDA,ATZ,,,mda_canada,md&a,,md&a,,18,11,11,"We completed retrofitting work in this facility in Q2 2026 to help optimize our operations. In Fiscal 2025, construction activities commenced on a new 380,000 square foot facility in Delta, British Columbia. When completed, this new facility will be operated by us and is expected to be operational in early Fiscal 2027. We plan to retain our current facility in New Westminster, British Columbia for storage and office space purposes, among other things. We plan on implementing increased automation, including robotic equipment in this new facility to increase our efficiencies and throughput. Our current facilities are set up to flexibly manage multi-channel and Omni channel demands, as our business continues to grow, and these further expansions will also support both our retail and Digital businesses with added capacity to handle higher levels of throughput. Omni-Channel Capabilities In Fiscal 2025, we successfully ramped up Buy Online, Pick-Up In Store and stabilized our Buy Online, Ship From Store capabilities. These new capabilities enabled us to maximize sales and profitability by offering customers more order options. Our Omni channel was built on the foundation of our point-of-sale system and investment in digital selling tools to enable omni-channel capabilities and optimize our technical systems and architecture. The project brought to life a new order fulfillment solution, the physical optimization of our backroom spaces, foundational order sourcing technology, and enhancements to our digital customer experience. The Omni channel capabilities are as follows: • Buy Online, Ship From Store – Available in most boutiques in Canada and the U.S., this capability introduces store inventory online, ensuring our full product assortment is available on aritzia.com. It also enables strategic targeting of inventory across our network of boutiques and minimizes delivery time to our clients. • Buy Online, Pick-up In Store – Available in most boutiques in Canada and the U.S., this capability provides clients with the option to pick up their online order in store. Building on store inventory visibility, this capability further integrates the online and in-store experiences leveraging the strong service in our boutiques to deliver an elevated, yet convenient experience.",nlp\raw_data\sec_can\atz_q_mda\Aritzia-Inc-Q2-2026-MDA.pdf
Aritzia-Inc-Q2-2026-MDA-19,Aritzia-Inc-Q2-2026-MDA,ATZ,,,mda_canada,md&a,,md&a,,19,11,12,"It is expected to also drive traffic to our boutiques and lead to additional opportunities for purchases upon pick up. • Store Inventory Visibility – This functionality enhances the client experience on aritzia.com by providing visibility of product availability in our boutiques. This initiative drives cross-channel shopping behavior and reduces contacts to our Concierge team by enabling clients to self-serve on common product availability related questions. We’ve also made meaningful improvements to the availability of fulfillment data and analytics as well as tools to maintain inventory accuracy and management which has resulted in improved fulfillment rates in stores. Impact and Governance Reflecting the importance of sustainability-related risks and opportunities to our business and brands, and as a prominent player in the fashion industry, Aritzia believes it has a responsibility to strengthen our efforts of delivering Everyday Luxury™ responsibly. As our business grows, so does our potential to create lasting change - we remain committed to advancing our Impact goals and measuring our year-over-year progress against published targets. At Aritzia, Impact refers to the contributions we make to People and the Planet across our full value chain - from raw material sourcing through to product end-of-life. As we continue to grow our business, we plan to increase our efforts to embed sustainability into how we operate - focusing on the areas where we can make the greatest positive impact. Across our supply chain, we are aiming to invest in preferred materials (terminology aligned to the Textile Exchange, a global nonprofit setting industry standards for sustainable fibers and materials to improve clarity and comparability) and collaborating with partners to advance responsible practices. We believe these contributions matter to our clients and we seek to take an evidence-based approach and to deliver long-term positive impact for the benefit of our business resilience and our stakeholders. Our Impact priorities are guided by the findings in our materiality assessment - which identified a prioritized list of the most significant sustainability issues, risks and opportunities that are important to long-term resilience. In Fiscal 2025, we reached a significant milestone in our climate strategy by meeting our near-term goal to establish science- based emissions reduction targets.",nlp\raw_data\sec_can\atz_q_mda\Aritzia-Inc-Q2-2026-MDA.pdf
Aritzia-Inc-Q2-2026-MDA-20,Aritzia-Inc-Q2-2026-MDA,ATZ,,,mda_canada,md&a,,md&a,,20,12,13,"These targets were set using the Science Based Target initiative's (""SBTi"") tools for emission reductions, based on a 2022 baseline emissions inventory which are aligned with GHG Protocol and validated by the SBTi. We continued to support the communities we serve through product donations, financial support and employee volunteer hours. Additionally, we enhanced our support for employees through expanded parenthood benefits and remained committed to our belonging and inclusion initiatives. Consumer Trends The apparel industry is subject to shifts in consumer trends, preferences and consumer spending and our revenue and operating results depend, in part, on our ability to respond to such changes and in a timely manner. Our differentiated multi-brand strategy gives us control over our products and provides us with the flexibility to optimize our brand mix as needed to address changes in consumer demand and fashion preferences, which has historically been a critical driver of our growth. Our revenue is also impacted by discretionary spending by consumers, which is affected by many factors that are beyond our control, including, but not limited to, general economic conditions, tariff and international trade policies that could put pressure on our pricing, consumer disposable income levels, consumer confidence levels, consumer debt, inflation, the cost of basic necessities and other goods and the effects of weather, natural disasters or global pandemics. We believe that our track record demonstrates the success of our exclusive brand strategy at responding to changes in fashion demands through all stages of economic cycles. Seasonality The apparel industry is seasonal in nature, with a higher proportion of net revenue and operating income generated in the second half of the fiscal year, which includes the back-to-school and holiday seasons. We also have higher working capital requirements in the periods preceding the launch of new seasons as we receive and pay for new inventory. We manage our working capital needs through cash flow from operations and our revolving credit facility. Average quarterly share of annual net revenue over the last three completed fiscal years is as follows: First fiscal quarter 19% Second fiscal quarter 23% Third fiscal quarter 28% Fourth fiscal quarter 30% Yearly total 100% Weather Extreme weather conditions in the areas in which our boutiques are located could adversely affect our business and financial results.",nlp\raw_data\sec_can\atz_q_mda\Aritzia-Inc-Q2-2026-MDA.pdf
Aritzia-Inc-Q2-2026-MDA-21,Aritzia-Inc-Q2-2026-MDA,ATZ,,,mda_canada,md&a,,md&a,,21,13,13,"For example, frequent or unusually heavy snowfall, ice storms, rainstorms or other extreme weather conditions over a prolonged period could make it difficult for our clients to travel to our boutiques and thereby reduce our revenue and profitability. This is potentially mitigated by our clients’ ability to buy our products through aritzia.com. Our business is also susceptible to unseasonable weather conditions. For example, extended periods of unseasonably warm temperatures during the winter season or cool weather during the summer season could render a portion of our inventory incompatible with those unseasonable conditions, which could adversely affect our ability to execute our strategy to effectively present seasonal inventory. Further, extreme weather conditions and natural disasters could materially impact our supply chain network. Competition We operate in the apparel industry, primarily within the Canadian and United States markets. We are strategically positioned in the global fashion landscape between fast fashion and luxury. We compete with a diverse group of specialty apparel retailers, department stores, fast fashion retailers, athletic retailers and other manufacturers and retailers of branded apparel. Market participants compete on the basis of, among other things, the location of boutiques, eCommerce experience, the breadth, style, quality, price and availability of merchandise, the level of client service and brand recognition. We believe that we successfully compete on the basis of several factors that include our strategic mix of exclusive brands and iconically Aritzia products, offering of a combination of high quality products at an attainable price point, our refined and evolving merchandise planning strategy, our focus on providing an aspirational shopping experience and exceptional client service, our premier real estate portfolio, captivating content and communications, and our market positioning, collectively resulting in a fashion brand loved by our clients all over the world. Foreign Exchange Over half of our net revenue is derived in U.S. dollars and the vast majority of our inventory purchases are denominated in U.S. dollars. Both our net revenues and cost of goods sold could be impacted significantly by changes in the value of the Canadian dollar against the U.S. dollar. Fluctuations in the exchange rate of the Canadian dollar versus the U.S.",nlp\raw_data\sec_can\atz_q_mda\Aritzia-Inc-Q2-2026-MDA.pdf
Aritzia-Inc-Q2-2026-MDA-22,Aritzia-Inc-Q2-2026-MDA,ATZ,,,mda_canada,md&a,,md&a,,22,13,13,"dollar could materially affect our gross profit margins and operating results. If needed, we will use foreign currency forward contracts to mitigate risks associated with forecasted U.S. dollar merchandise purchases sold in Canada, but there can be no assurances that such strategies will prove to be successful. See the “Risk Factors” section of this MD&A. NON-IFRS FINANCIAL MEASURES AND RETAIL INDUSTRY METRICS This MD&A makes reference to certain non-IFRS Accounting Standards measures (""non-IFRS financial measures"") and certain retail industry metrics. These measures are not recognized measures under IFRS Accounting Standards, do not have a standardized meaning prescribed by IFRS Accounting Standards and are therefore unlikely to be comparable to similar measures presented by other companies. Rather, these measures are provided as additional information to complement those IFRS Accounting Standards measures by providing further understanding of our results of operations from management’s perspective. Accordingly, these measures should not be considered in isolation or as a substitute for analysis of our financial information reported under IFRS Accounting Standards. We use non-IFRS financial measures including “EBITDA”, “Adjusted EBITDA”, and “Adjusted Net Income”; non-IFRS Accounting Standards ratios (""non-IFRS ratios"") including “Adjusted Net Income per Diluted Share”, ""Adjusted EBITDA as a percentage of net revenue"", and ""Adjusted Net Income as a percentage of net revenue""; and capital management measures including “capital cash expenditures (net of proceeds from lease incentives)”, and “free cash flow.” This MD&A also makes reference to “gross profit margin”, ""comparable sales"", and ""constant currency"" which are commonly used operating metrics in the retail industry but may be calculated differently by other retailers. Gross profit margin, comparable sales and constant currency are considered supplementary financial measures under applicable securities laws. These non-IFRS financial measures and retail industry metrics are used to provide investors with supplemental measures of our operating performance and thus highlight trends in our core business that may not otherwise be apparent when relying solely on IFRS Accounting Standards measures.",nlp\raw_data\sec_can\atz_q_mda\Aritzia-Inc-Q2-2026-MDA.pdf
Aritzia-Inc-Q2-2026-MDA-23,Aritzia-Inc-Q2-2026-MDA,ATZ,,,mda_canada,md&a,,md&a,,23,13,14,"We believe that securities analysts, investors and other interested parties frequently use non- IFRS financial measures and retail industry metrics in the evaluation of issuers. Our management also uses non- IFRS financial measures and retail industry metrics in order to facilitate operating performance comparisons from period to period, to prepare annual operating budgets and forecasts and to determine components of management compensation. For definitions of these non-IFRS financial measures and retail industry metrics and reconciliations of these non-IFRS financial measures to the relevant reported measures, please see the “How We Assess the Performance of Our Business” and “Selected Financial Information” sections of this MD&A. HOW WE ASSESS THE PERFORMANCE OF OUR BUSINESS In assessing the performance of our business, we consider a variety of financial and operating measures that affect our operating results. Net revenue reflects our sale of merchandise, less returns and discounts. The Company recognizes revenue when control of the goods or services has been transferred to the customer which generally occurs when the product is delivered to the customer and therefore may be subject to deferral. Revenue is measured at the fair value of consideration to which the Company expects to be entitled to, including variable consideration, if any, to the extent it is highly probable that a significant reversal will not occur. Revenues are measured net of discounts and an estimated allowance for returns. Revenues are reported net of sales taxes collected for various governmental agencies. Receipts from the sale of gift cards are treated as deferred revenue. When gift cards are redeemed for merchandise, the related revenue is recognized. Comparable sales is a retail industry metric used to explain our total combined revenue growth (decline) (in absolute dollars or percentage terms) in eCommerce and established boutiques over the comparative reportable period. Comparable sales from established boutiques is calculated based on revenue from boutiques that have been opened for at least 56 weeks, and excludes boutiques that were repositioned, boutiques in centres where we opened a new additional boutique and boutiques significantly impacted by nearby construction and other similar disruptions during this period. Our comparable sales calculation excludes the impact of foreign currency fluctuations.",nlp\raw_data\sec_can\atz_q_mda\Aritzia-Inc-Q2-2026-MDA.pdf
Aritzia-Inc-Q2-2026-MDA-24,Aritzia-Inc-Q2-2026-MDA,ATZ,,,mda_canada,md&a,,md&a,,24,14,14,"We apply the relevant prior year comparative’s average foreign currency exchange rate for the period to both current year and prior year comparable sales to achieve a consistent basis for comparison (i.e., on a constant currency basis). Constant currency change in net revenue assumes the average foreign currency exchange rates for the period remained constant with the average foreign currency exchange rates for the same period of the prior year. The constant currency change helps provide investors an understanding of the underlying growth rate of net revenue excluding the impact of changes in foreign currency exchange rates. Gross profit reflects our net revenue less cost of goods sold. Cost of goods sold includes inventory and product- related costs, occupancy costs, and depreciation expense for our boutiques and distribution centres. Our cost of goods sold may include different costs compared to other retailers. Gross profit margin is impacted by the components of cost of goods sold, product mix and markdowns. We define gross profit margin as our gross profit divided by our net revenue. Selling, general and administrative (“SG&A”) expenses consists of selling expenses that are generally variable with net revenue and general and administrative operating expenses that are primarily fixed. Our SG&A expenses also include depreciation and amortization expenses for all support office assets and intangible assets. SG&A expenses as a percentage of net revenue, excluding strategic investments in technology and infrastructure, are usually higher in the lower net revenue volume first and second quarters, and lower in the higher net revenue volume third and fourth quarters because a portion of these costs are relatively fixed. Our SG&A expenses may include different expenses compared to other retailers. EBITDA is defined as consolidated net income before depreciation and amortization, finance expense and income tax expense. We believe this measure is useful as it is used by management as a component of reconciliation between other non-IFRS financial measures and their most comparable IFRS Accounting Standards measure.",nlp\raw_data\sec_can\atz_q_mda\Aritzia-Inc-Q2-2026-MDA.pdf
Aritzia-Inc-Q2-2026-MDA-25,Aritzia-Inc-Q2-2026-MDA,ATZ,,,mda_canada,md&a,,md&a,,25,15,15,"Adjusted EBITDA and Adjusted EBITDA as a percentage of net revenue are useful measures of operating performance, as we believe they provide a more relevant picture of operating results in that the measures exclude the effects of financing and investing activities by removing the effects of interest, depreciation and amortization expenses that are not reflective of underlying business performance and other one-time or non-recurring expenses. We use Adjusted EBITDA and Adjusted EBITDA as a percentage of net revenue to facilitate a comparison of our operating performance on a consistent basis from period-to-period and to provide for a more complete understanding of factors and trends affecting our business. We define Adjusted EBITDA as consolidated net income before depreciation and amortization, finance expense and income tax expense, adjusted for the impact of certain items, such as a deduction of interest expense and depreciation relating to our leases to reflect an estimate of rent expense and including non-cash items and/or items we consider non-recurring and not representative of our ongoing operating performance, such as stock-based compensation expense, unrealized gains or losses on equity derivative and forward contracts and other similar fair value adjustments. Because Adjusted EBITDA excludes certain non-cash items, we believe that it is less susceptible to variances in actual performance resulting from depreciation and amortization and other non-cash charges. We define Adjusted EBITDA as a percentage of net revenue as the percentage obtained by dividing Adjusted EBITDA by net revenue. Adjusted Net Income (and per Diluted Share) and Adjusted Net Income as a percentage of net revenue are useful measures of performance, as we believe they provide a more relevant picture of results by excluding the effects of expenses that are not reflective of underlying business performance and other one-time or non-recurring expenses. We use Adjusted Net Income, Adjusted Net Income per Diluted Share, and Adjusted Net Income as a percentage of net revenue to facilitate a comparison of our performance on a consistent basis from period-to-period and to provide for a more complete understanding of factors and trends affecting our business.",nlp\raw_data\sec_can\atz_q_mda\Aritzia-Inc-Q2-2026-MDA.pdf
Aritzia-Inc-Q2-2026-MDA-26,Aritzia-Inc-Q2-2026-MDA,ATZ,,,mda_canada,md&a,,md&a,,26,15,15,"We define Adjusted Net Income as consolidated net income adjusted for the impact of certain items, including non-cash items and/or other items we consider non-recurring and not representative of our ongoing operating performance, such as stock- based compensation expense, unrealized gains or losses on equity derivative and forward contracts and other similar fair value adjustments, net of related tax effects. We define Adjusted Net Income per Diluted Share by dividing Adjusted Net Income by the weighted average number of diluted shares outstanding. We define Adjusted Net Income as a percentage of net revenue as the percentage obtained by dividing Adjusted Net Income by net revenue. Capital cash expenditures (net of proceeds from lease incentives) is a measure we believe to be a useful indicator of the net cash capital investment relating to our boutiques and infrastructure. We define capital cash expenditures (net of proceeds from lease incentives) as cash used in investing activities, excluding cash used in business combinations and other acquisitions, less proceeds from lease incentives. Free cash flow is a useful metric because it is an indicator of how much cash is available for business acquisitions, debt repayment, share repurchases and other investing and financing activities. Our sustained ability to generate free cash flow is an indicator of the financial strength of our business, as we require regular capital expenditures to build and maintain boutiques and invest in infrastructure. We define free cash flow as net cash generated from operating activities excluding interest paid on credit facilities, less repayments of principal on lease liabilities and capital cash expenditures (net of proceeds from lease incentives).",nlp\raw_data\sec_can\atz_q_mda\Aritzia-Inc-Q2-2026-MDA.pdf
Aritzia-Inc-Q2-2026-MDA-27,Aritzia-Inc-Q2-2026-MDA,ATZ,,,mda_canada,md&a,,md&a,,27,16,16,"results of operations analysis of results for second quarter fiscal 2026 consolidated statements of operations ( unaudited, in thousands of canadian dollars, unless otherwise noted ) q2 2026 q2 2025 % of net % of net revenue revenue net revenue $ 812, 054 100. 0 % $ 615, 663 100. 0 % cost of goods sold 456, 424 56. 2 % 368, 177 59. 8 % gross profit 355, 630 43. 8 % 247, 486 40. 2 % selling, general and administrative 250, 213 30. 8 % 199, 502 32. 4 % stock - based compensation expense 14, 160 1. 7 % 13, 426 2. 2 % income from operations 91, 257 11. 2 % 34, 558 5. 6 % finance expense 13, 678 1. 7 % 12, 842 2. 1 % other expense ( income ) ( 13, 066 ) ( 1. 6 ) % ( 5, 529 ) ( 0. 9 ) % income before income taxes 90, 645 11. 2 % 27, 245 4. 4 % income tax expense 24, 344 3. 0 % 8, 998 1. 5 % net income $ 66, 301 8. 2 % $ 18, 247 3. 0 % net income per diluted share $ 0. 56 $ 0. 16 adjusted ebitda1 $ 122, 720 15. 1 % $ 55, 167 9. 0 % adjusted net income1 $ 69, 822 8. 6 % $ 24, 536 4. 0 % adjusted net income per diluted share1 $ 0. 59 $ 0. 21 net revenue increased 31. 9 % to $ 812. 1 million, compared to $ 615. 7 million in q2 2025, or increased 31. 8 % on a constant currency2 basis, driven by strong comparable sales growth and the company's new and repositioned boutiques. Comparable sales2 grew 21.6%, as all channels and all geographies generated positive double-digit growth.",nlp\raw_data\sec_can\atz_q_mda\Aritzia-Inc-Q2-2026-MDA.pdf
Aritzia-Inc-Q2-2026-MDA-28,Aritzia-Inc-Q2-2026-MDA,ATZ,,,mda_canada,md&a,,md&a,,28,16,17,"This was driven by robust demand for the Company's Summer assortment and an outstanding client response to the launch of its Fall collection, as well as the Company's strong inventory position and strategic marketing investments. – In the United States, net revenue increased 40.7% to $486.1 million, compared to $345.4 million in Q2 2025. This was fueled by the Company's real estate expansion strategy, continued momentum in eCommerce and strong comparable sales growth in existing boutiques. – Net revenue in Canada increased 20.6% to $326.0 million, compared to $270.3 million in Q2 2025, driven by the strong performance of the Company's product, supported by strategic marketing investments. – Retail net revenue increased 34.3% to $571.7 million, compared to $425.6 million in Q2 2025. The net revenue increase was driven by high-teens comparable sales growth in existing boutiques and the strong performance of the Company's new and repositioned boutiques. In the last 12 months, the Company opened 13 new boutiques and repositioned four boutiques. Boutique count5 at the end of Q2 2026 totaled 134 compared to 122 boutiques at the end of Q2 2025. – eCommerce net revenue increased 26.5% to $240.3 million, compared to $190.0 million in Q2 2025. The continued momentum in eCommerce was fueled by strong traffic growth due to the positive response to the Company's product and its investments in digital marketing. 5 CYC had three Reigning Champ boutiques as at August 31, 2025 (four boutiques as at September 1, 2024) which are excluded from the boutique count. There was one Aritzia boutique closure in Fiscal 2025. The following table provides net revenue by channel and geographic location for the periods indicated.",nlp\raw_data\sec_can\atz_q_mda\Aritzia-Inc-Q2-2026-MDA.pdf
